id,ФИО,Должность,Специализация,Стаж,id_Repair_Station
734,Flinn Pinks,Civil Engineer,Quisque ut erat.,37,734
735,Currie Petcher,Quality Engineer,In congue. Etiam justo.,31,735
736,Emelen Abberley,Nuclear Power Engineer,Nulla suscipit ligula in lacus.,26,736
737,Gaynor Traice,Operator,Quisque ut erat. Curabitur gravida nisi at nibh.,32,737
738,Clarie Jorn,Accounting Assistant III,Etiam vel augue.,38,738
739,Donia Redmond,Professor,Donec posuere metus vitae ipsum.,37,739
740,Jobi Jacke,VP Quality Control,"Nulla neque libero, convallis eget, eleifend luctus, ultricies eu, nibh. Quisque id justo sit amet sapien dignissim vestibulum.",4,740
741,Clayton Rannigan,Quality Engineer,"Integer pede justo, lacinia eget, tincidunt eget, tempus vel, pede. Morbi porttitor lorem id ligula.",11,741
742,Carce de Aguirre,Account Coordinator,Ut at dolor quis odio consequat varius. Integer ac leo.,14,742
743,Davey Kenlin,Professor,"Nullam orci pede, venenatis non, sodales sed, tincidunt eu, felis. Fusce posuere felis sed lacus.",24,743
744,Christabella Kareman,Financial Analyst,Morbi non lectus.,11,744
745,Tamara Stanesby,Physical Therapy Assistant,Curabitur at ipsum ac tellus semper interdum. Mauris ullamcorper purus sit amet nulla.,8,745
746,Darline Stones,Editor,Sed vel enim sit amet nunc viverra dapibus. Nulla suscipit ligula in lacus.,21,746
747,Maje Muscroft,Speech Pathologist,Vestibulum ante ipsum primis in faucibus orci luctus et ultrices posuere cubilia Curae; Duis faucibus accumsan odio.,17,747
748,Pattin Zienkiewicz,Electrical Engineer,"In est risus, auctor sed, tristique in, tempus sit amet, sem.",40,748
749,Pennie Eversfield,Pharmacist,"In tempor, turpis nec euismod scelerisque, quam turpis adipiscing lorem, vitae mattis nibh ligula nec sem.",9,749
750,Dorena Spadeck,Structural Engineer,Aenean auctor gravida sem. Praesent id massa id nisl venenatis lacinia.,40,750
751,Darryl Bigg,Software Test Engineer II,Nunc nisl.,31,751
752,Webster Fudger,Occupational Therapist,Aliquam quis turpis eget elit sodales scelerisque.,1,752
753,Lela Dimitresco,Automation Specialist III,Etiam faucibus cursus urna. Ut tellus.,39,753
754,Sarge Hrinishin,Information Systems Manager,Suspendisse potenti. Nullam porttitor lacus at turpis.,30,754
755,Lori Guild,Analyst Programmer,"Morbi vestibulum, velit id pretium iaculis, diam erat fermentum justo, nec condimentum neque sapien placerat ante. Nulla justo.",18,755
756,Errick Rockwell,Administrative Officer,"Nam congue, risus semper porta volutpat, quam pede lobortis ligula, sit amet eleifend pede libero quis orci. Nullam molestie nibh in lectus.",21,756
757,Jerrylee Armell,Help Desk Operator,Vivamus in felis eu sapien cursus vestibulum.,40,757
758,Meg Paulat,Assistant Media Planner,"Nam nulla. Integer pede justo, lacinia eget, tincidunt eget, tempus vel, pede.",34,758
759,Mollee Ing,Recruiter,Curabitur convallis.,34,759
760,Jerrie Speedy,Payment Adjustment Coordinator,"Praesent lectus. Vestibulum quam sapien, varius ut, blandit non, interdum in, ante.",18,760
761,Nita Sappell,Geologist II,"Nam congue, risus semper porta volutpat, quam pede lobortis ligula, sit amet eleifend pede libero quis orci.",17,761
762,Lezlie Sole,Accounting Assistant I,"In hac habitasse platea dictumst. Aliquam augue quam, sollicitudin vitae, consectetuer eget, rutrum at, lorem.",8,762
763,Aviva Scholey,Systems Administrator III,Phasellus id sapien in sapien iaculis congue.,39,763
764,Arielle Fayers,Mechanical Systems Engineer,Sed accumsan felis. Ut at dolor quis odio consequat varius.,13,764
765,Coralie Lomansey,Legal Assistant,Nullam varius.,8,765
766,Magdalene Sperling,Clinical Specialist,Proin risus.,5,766
767,Beck Jurges,Business Systems Development Analyst,Suspendisse potenti. Nullam porttitor lacus at turpis.,13,767
768,Cecelia Weatherley,Account Coordinator,Vestibulum sed magna at nunc commodo placerat.,8,768
769,Shawna Treacy,Cost Accountant,Nullam molestie nibh in lectus. Pellentesque at nulla.,37,769
770,Maren Wadmore,Health Coach III,"Donec vitae nisi. Nam ultrices, libero non mattis pulvinar, nulla pede ullamcorper augue, a suscipit nulla elit ac nulla.",9,770
771,Quintus Whittlesea,Librarian,"In tempor, turpis nec euismod scelerisque, quam turpis adipiscing lorem, vitae mattis nibh ligula nec sem. Duis aliquam convallis nunc.",39,771
772,Flo Bohea,Tax Accountant,Vivamus tortor. Duis mattis egestas metus.,26,772
773,Fritz Lydall,VP Sales,Vestibulum ac est lacinia nisi venenatis tristique.,6,773
774,Enrico Kondratenko,Mechanical Systems Engineer,Aenean auctor gravida sem.,36,774
775,Uriel Pfleger,Pharmacist,Aenean fermentum.,28,775
776,Della Cassidy,Software Test Engineer IV,Duis mattis egestas metus.,25,776
777,Jodie Klagges,Executive Secretary,Sed ante.,17,777
778,Baxie Gilbert,Cost Accountant,"Phasellus id sapien in sapien iaculis congue. Vivamus metus arcu, adipiscing molestie, hendrerit at, vulputate vitae, nisl.",37,778
779,Quintilla Linstead,Nurse Practicioner,Duis at velit eu est congue elementum. In hac habitasse platea dictumst.,20,779
780,Lucita Wiggington,Sales Associate,Phasellus in felis. Donec semper sapien a libero.,29,780
781,Carolina Croshaw,Environmental Tech,Curabitur gravida nisi at nibh. In hac habitasse platea dictumst.,15,781
782,Silvia Seiter,Sales Associate,Suspendisse potenti.,9,782
783,Sophia Wyldish,Marketing Manager,Proin risus.,23,783
784,Traver Pate,Community Outreach Specialist,"Morbi vestibulum, velit id pretium iaculis, diam erat fermentum justo, nec condimentum neque sapien placerat ante.",14,784
785,Tallia Firminger,Legal Assistant,Proin interdum mauris non ligula pellentesque ultrices.,24,785
786,Ingmar Gebhardt,Financial Analyst,Proin risus.,2,786
787,Kliment Copp,Assistant Media Planner,Fusce consequat.,33,787
788,Tierney McKinnon,VP Marketing,Nullam molestie nibh in lectus.,27,788
789,Orelie Spaxman,Research Assistant II,Maecenas ut massa quis augue luctus tincidunt. Nulla mollis molestie lorem.,26,789
790,Wolf Buttwell,Automation Specialist I,Praesent blandit lacinia erat. Vestibulum sed magna at nunc commodo placerat.,29,790
791,Edith Freyn,Nurse,Quisque ut erat.,22,791
792,William O'Dea,VP Product Management,Nulla justo. Aliquam quis turpis eget elit sodales scelerisque.,5,792
793,Theo Hurdis,Health Coach III,Sed vel enim sit amet nunc viverra dapibus. Nulla suscipit ligula in lacus.,32,793
794,Dinny Bragg,Safety Technician I,Donec dapibus. Duis at velit eu est congue elementum.,2,794
795,Lucho McConachie,GIS Technical Architect,"Suspendisse ornare consequat lectus. In est risus, auctor sed, tristique in, tempus sit amet, sem.",32,795
796,Gideon Limon,Research Nurse,Nulla nisl. Nunc nisl.,16,796
797,Esma Haining,Staff Scientist,Curabitur convallis.,1,797
798,Michaella Conigsby,Junior Executive,Nulla suscipit ligula in lacus. Curabitur at ipsum ac tellus semper interdum.,22,798
799,Sanders Lardiner,Pharmacist,Aliquam non mauris.,2,799
800,Luelle Fedoronko,Legal Assistant,"Curabitur in libero ut massa volutpat convallis. Morbi odio odio, elementum eu, interdum eu, tincidunt in, leo.",2,800
801,Dani Manchett,Research Nurse,Vestibulum ante ipsum primis in faucibus orci luctus et ultrices posuere cubilia Curae; Duis faucibus accumsan odio. Curabitur convallis.,25,801
802,Maudie Elvey,Biostatistician IV,Morbi porttitor lorem id ligula.,8,802
803,Pete Greystoke,Tax Accountant,Etiam faucibus cursus urna. Ut tellus.,36,803
804,Karisa O'Murtagh,Associate Professor,Nullam varius. Nulla facilisi.,33,804
805,Muffin Candlish,Senior Financial Analyst,Donec dapibus. Duis at velit eu est congue elementum.,28,805
806,Aura Vakhlov,Human Resources Assistant I,Nulla nisl.,1,806
807,Vivien Gregson,Product Engineer,"Vestibulum quam sapien, varius ut, blandit non, interdum in, ante.",33,807
808,Eugene Ambroise,Senior Financial Analyst,Nullam sit amet turpis elementum ligula vehicula consequat. Morbi a ipsum.,32,808
809,Shaine Moens,Web Developer I,Morbi vel lectus in quam fringilla rhoncus.,20,809
810,Casandra Hemmingway,Data Coordiator,In quis justo.,28,810
811,Dorine Tessington,Administrative Assistant IV,Pellentesque ultrices mattis odio.,0,811
812,Michaelina Lestrange,Biostatistician II,"Maecenas leo odio, condimentum id, luctus nec, molestie sed, justo. Pellentesque viverra pede ac diam.",36,812
813,Catherin Baccus,Physical Therapy Assistant,Vestibulum ante ipsum primis in faucibus orci luctus et ultrices posuere cubilia Curae; Duis faucibus accumsan odio.,39,813
814,Garik Gregorin,Nurse,Maecenas pulvinar lobortis est. Phasellus sit amet erat.,5,814
815,Reba Alflat,Speech Pathologist,Nullam sit amet turpis elementum ligula vehicula consequat.,14,815
816,Husein Tunna,Desktop Support Technician,Nullam sit amet turpis elementum ligula vehicula consequat. Morbi a ipsum.,20,816
817,Lorrie Abry,Staff Accountant II,"Aliquam sit amet diam in magna bibendum imperdiet. Nullam orci pede, venenatis non, sodales sed, tincidunt eu, felis.",2,817
818,Witty Stones,Administrative Assistant III,Nullam porttitor lacus at turpis.,19,818
819,Allina Lummasana,Community Outreach Specialist,Duis ac nibh.,21,819
820,Stillman Sinson,Editor,"Vestibulum ac est lacinia nisi venenatis tristique. Fusce congue, diam id ornare imperdiet, sapien urna pretium nisl, ut volutpat sapien arcu sed augue.",22,820
821,Chrysa Tiptaft,Geologist I,Etiam pretium iaculis justo. In hac habitasse platea dictumst.,3,821
822,Klarrisa Dybbe,Sales Associate,Praesent blandit.,15,822
823,Kerri Bidewell,Nurse,Proin interdum mauris non ligula pellentesque ultrices. Phasellus id sapien in sapien iaculis congue.,5,823
824,Danna Driver,Graphic Designer,Curabitur in libero ut massa volutpat convallis.,13,824
825,Giacinta Earle,GIS Technical Architect,Fusce posuere felis sed lacus.,2,825
826,Glynnis Steen,Programmer Analyst IV,"Morbi quis tortor id nulla ultrices aliquet. Maecenas leo odio, condimentum id, luctus nec, molestie sed, justo.",29,826
827,Xever Marsh,Research Assistant II,Duis aliquam convallis nunc. Proin at turpis a pede posuere nonummy.,18,827
828,Serene De La Hay,Accounting Assistant IV,"Vestibulum quam sapien, varius ut, blandit non, interdum in, ante.",38,828
829,Sheridan Salisbury,Sales Associate,Duis ac nibh.,12,829
830,Tamar MacAnespie,Accountant II,Fusce consequat.,36,830
831,Aeriel Leese,Health Coach III,Mauris ullamcorper purus sit amet nulla.,30,831
832,Byron Rothwell,Sales Representative,Nulla suscipit ligula in lacus.,34,832
833,Binnie Zoren,Biostatistician I,Phasellus in felis. Donec semper sapien a libero.,24,833
834,Meredith Stobie,Associate Professor,"Quisque porta volutpat erat. Quisque erat eros, viverra eget, congue eget, semper rutrum, nulla.",4,834
835,Arman Bristoe,Graphic Designer,Vivamus in felis eu sapien cursus vestibulum. Proin eu mi.,9,835
836,Ronnica Treacy,Geological Engineer,Vivamus vel nulla eget eros elementum pellentesque.,11,836
837,Frannie Triplow,Research Associate,Quisque id justo sit amet sapien dignissim vestibulum. Vestibulum ante ipsum primis in faucibus orci luctus et ultrices posuere cubilia Curae; Nulla dapibus dolor vel est.,1,837
838,Euphemia Peffer,Electrical Engineer,Ut at dolor quis odio consequat varius.,39,838
839,Hymie Castagne,Speech Pathologist,"Morbi sem mauris, laoreet ut, rhoncus aliquet, pulvinar sed, nisl. Nunc rhoncus dui vel sem.",11,839
840,Skylar Durrett,Financial Advisor,Proin risus.,20,840
841,Mendy Reame,Financial Analyst,Suspendisse accumsan tortor quis turpis.,34,841
842,Ofella Romei,Recruiting Manager,Nullam porttitor lacus at turpis.,13,842
843,Aloysius Gascard,Health Coach IV,"Morbi sem mauris, laoreet ut, rhoncus aliquet, pulvinar sed, nisl.",13,843
844,Lucretia Tennison,Occupational Therapist,Etiam vel augue. Vestibulum rutrum rutrum neque.,5,844
845,Bernete Chazelle,Executive Secretary,In quis justo. Maecenas rhoncus aliquam lacus.,24,845
846,Colly Viegas,Compensation Analyst,Praesent blandit lacinia erat. Vestibulum sed magna at nunc commodo placerat.,12,846
847,Nickie Mongenot,Quality Engineer,Mauris sit amet eros. Suspendisse accumsan tortor quis turpis.,40,847
848,Hattie Hands,Design Engineer,Integer non velit.,40,848
849,Rachel Clyde,Computer Systems Analyst I,Mauris lacinia sapien quis libero. Nullam sit amet turpis elementum ligula vehicula consequat.,28,849
850,Mitzi de Villier,Software Consultant,Pellentesque ultrices mattis odio. Donec vitae nisi.,14,850
851,Ninnetta Chalfont,Accounting Assistant III,"Fusce congue, diam id ornare imperdiet, sapien urna pretium nisl, ut volutpat sapien arcu sed augue. Aliquam erat volutpat.",34,851
852,Otha Girodin,Help Desk Technician,Integer ac neque.,19,852
853,Kerr Grinyer,Staff Scientist,Vestibulum rutrum rutrum neque.,2,853
854,Haleigh Benedicte,Sales Associate,"Quisque erat eros, viverra eget, congue eget, semper rutrum, nulla. Nunc purus.",26,854
855,Amble Skelhorne,Software Consultant,Vestibulum ante ipsum primis in faucibus orci luctus et ultrices posuere cubilia Curae; Mauris viverra diam vitae quam. Suspendisse potenti.,2,855
856,Susana Georgius,Technical Writer,"Donec diam neque, vestibulum eget, vulputate ut, ultrices vel, augue. Vestibulum ante ipsum primis in faucibus orci luctus et ultrices posuere cubilia Curae; Donec pharetra, magna vestibulum aliquet ultrices, erat tortor sollicitudin mi, sit amet lobortis sapien sapien non mi.",12,856
857,Blondelle Effemy,Assistant Professor,Etiam faucibus cursus urna. Ut tellus.,1,857
858,Amalee Vondrak,Marketing Manager,"Lorem ipsum dolor sit amet, consectetuer adipiscing elit. Proin risus.",23,858
859,Sullivan Larkings,Account Coordinator,Maecenas ut massa quis augue luctus tincidunt.,5,859
860,Lucina Rengger,Teacher,Maecenas tincidunt lacus at velit.,38,860
861,Kathleen Campa,Community Outreach Specialist,"Morbi vestibulum, velit id pretium iaculis, diam erat fermentum justo, nec condimentum neque sapien placerat ante.",32,861
862,Theodoric Hugill,Senior Cost Accountant,Ut at dolor quis odio consequat varius. Integer ac leo.,11,862
863,Greta Etchingham,Geological Engineer,"Cras mi pede, malesuada in, imperdiet et, commodo vulputate, justo. In blandit ultrices enim.",22,863
864,Carlo Sproson,Assistant Manager,"Duis bibendum, felis sed interdum venenatis, turpis enim blandit mi, in porttitor pede justo eu massa.",28,864
865,Orelie Pitcock,Technical Writer,Maecenas tincidunt lacus at velit. Vivamus vel nulla eget eros elementum pellentesque.,18,865
866,Edgard Catherall,VP Product Management,Aenean auctor gravida sem.,40,866
867,Tami Dahlen,Marketing Assistant,"Morbi sem mauris, laoreet ut, rhoncus aliquet, pulvinar sed, nisl.",2,867
868,Roanne Norcutt,Account Coordinator,Nullam varius. Nulla facilisi.,23,868
869,Roobbie Matthewson,Geological Engineer,"Suspendisse ornare consequat lectus. In est risus, auctor sed, tristique in, tempus sit amet, sem.",25,869
870,Giorgio Strickett,Civil Engineer,Morbi a ipsum. Integer a nibh.,13,870
871,Ayn Hance,Community Outreach Specialist,Duis bibendum. Morbi non quam nec dui luctus rutrum.,23,871
872,Laure Durdle,Accounting Assistant IV,"In hac habitasse platea dictumst. Aliquam augue quam, sollicitudin vitae, consectetuer eget, rutrum at, lorem.",14,872
873,Abbi Abramovic,Cost Accountant,Integer a nibh.,39,873
874,Derk Falcus,VP Sales,Ut at dolor quis odio consequat varius. Integer ac leo.,5,874
875,Tedie Edward,Office Assistant III,Donec ut dolor. Morbi vel lectus in quam fringilla rhoncus.,15,875
876,Hamnet Spalton,VP Quality Control,"Lorem ipsum dolor sit amet, consectetuer adipiscing elit. Proin risus.",11,876
877,Bette-ann Cote,Software Consultant,Nulla ac enim.,18,877
878,Patrizia Perrottet,Financial Analyst,Vivamus tortor. Duis mattis egestas metus.,31,878
879,Denis Hammett,VP Sales,"Donec ut mauris eget massa tempor convallis. Nulla neque libero, convallis eget, eleifend luctus, ultricies eu, nibh.",28,879
880,Cello Franzewitch,GIS Technical Architect,"Integer pede justo, lacinia eget, tincidunt eget, tempus vel, pede. Morbi porttitor lorem id ligula.",7,880
881,Karalynn Attewill,Director of Sales,"Cras pellentesque volutpat dui. Maecenas tristique, est et tempus semper, est quam pharetra magna, ac consequat metus sapien ut nunc.",0,881
882,Bette-ann Bretherton,Product Engineer,"Quisque porta volutpat erat. Quisque erat eros, viverra eget, congue eget, semper rutrum, nulla.",32,882
883,Anjela Draper,Structural Engineer,Integer ac leo.,16,883
884,Moreen Rush,Payment Adjustment Coordinator,Aliquam quis turpis eget elit sodales scelerisque.,21,884
885,Saunder Chitson,Electrical Engineer,Vivamus in felis eu sapien cursus vestibulum.,31,885
886,Zacherie Leonardi,Staff Accountant III,"Integer pede justo, lacinia eget, tincidunt eget, tempus vel, pede.",38,886
887,Eddie Upham,Quality Control Specialist,"In hac habitasse platea dictumst. Aliquam augue quam, sollicitudin vitae, consectetuer eget, rutrum at, lorem.",26,887
888,Chloette Haslock,Senior Quality Engineer,Curabitur gravida nisi at nibh.,23,888
889,Dexter Castangia,Director of Sales,"Nam dui. Proin leo odio, porttitor id, consequat in, consequat ut, nulla.",6,889
890,Sela Tointon,Structural Analysis Engineer,"Duis ac nibh. Fusce lacus purus, aliquet at, feugiat non, pretium quis, lectus.",34,890
891,Davina Peckett,Assistant Professor,Maecenas pulvinar lobortis est. Phasellus sit amet erat.,14,891
892,Jewelle Ghiraldi,Budget/Accounting Analyst IV,"Cum sociis natoque penatibus et magnis dis parturient montes, nascetur ridiculus mus.",18,892
893,Isak Truggian,Sales Associate,Donec vitae nisi.,6,893
894,Lorry MacKeever,Assistant Media Planner,"Fusce congue, diam id ornare imperdiet, sapien urna pretium nisl, ut volutpat sapien arcu sed augue. Aliquam erat volutpat.",15,894
895,Stillmann Woodroff,Occupational Therapist,Suspendisse potenti. Nullam porttitor lacus at turpis.,4,895
896,Frasquito Imort,Geologist III,Fusce consequat.,36,896
897,Zackariah Imlach,Graphic Designer,"Nulla neque libero, convallis eget, eleifend luctus, ultricies eu, nibh. Quisque id justo sit amet sapien dignissim vestibulum.",1,897
898,Micaela McGilbon,VP Quality Control,Morbi porttitor lorem id ligula.,32,898
899,Lilian Gianettini,Civil Engineer,Nulla justo. Aliquam quis turpis eget elit sodales scelerisque.,15,899
900,Sile Torns,Professor,Vestibulum ante ipsum primis in faucibus orci luctus et ultrices posuere cubilia Curae; Duis faucibus accumsan odio.,32,900
901,Farand Prestedge,Senior Financial Analyst,Vivamus vel nulla eget eros elementum pellentesque.,0,901
902,Christen Gother,Developer I,Suspendisse ornare consequat lectus.,38,902
903,Ellswerth Kelland,Research Assistant II,"Cras mi pede, malesuada in, imperdiet et, commodo vulputate, justo. In blandit ultrices enim.",11,903
904,Alidia Nickolls,Community Outreach Specialist,Etiam faucibus cursus urna.,14,904
905,Rusty Baroche,Help Desk Operator,Quisque ut erat. Curabitur gravida nisi at nibh.,31,905
906,Maxie Bowich,Financial Advisor,Aenean auctor gravida sem. Praesent id massa id nisl venenatis lacinia.,2,906
907,Liana Jowling,Paralegal,Fusce consequat. Nulla nisl.,2,907
908,Rolando Yoell,Cost Accountant,Sed accumsan felis.,8,908
909,Carree Grinyer,Senior Quality Engineer,"Phasellus id sapien in sapien iaculis congue. Vivamus metus arcu, adipiscing molestie, hendrerit at, vulputate vitae, nisl.",1,909
910,Zed Burbage,VP Quality Control,Suspendisse potenti.,16,910
911,Hilario Straughan,Associate Professor,"Integer pede justo, lacinia eget, tincidunt eget, tempus vel, pede.",20,911
912,Sumner Allred,Account Coordinator,"Quisque erat eros, viverra eget, congue eget, semper rutrum, nulla.",40,912
913,Ardyce Pannett,Structural Analysis Engineer,Fusce posuere felis sed lacus.,16,913
914,Angelo Sibthorpe,VP Sales,"Vestibulum ante ipsum primis in faucibus orci luctus et ultrices posuere cubilia Curae; Donec pharetra, magna vestibulum aliquet ultrices, erat tortor sollicitudin mi, sit amet lobortis sapien sapien non mi.",20,914
915,Herminia Brackstone,Compensation Analyst,Vestibulum rutrum rutrum neque.,38,915
916,Milena MacDirmid,Operator,"Nam congue, risus semper porta volutpat, quam pede lobortis ligula, sit amet eleifend pede libero quis orci.",27,916
917,Carilyn Kilgrew,GIS Technical Architect,"In hac habitasse platea dictumst. Morbi vestibulum, velit id pretium iaculis, diam erat fermentum justo, nec condimentum neque sapien placerat ante.",40,917
918,Lev Creaven,Analyst Programmer,Sed ante.,27,918
919,Guy Hordell,Analog Circuit Design manager,Fusce posuere felis sed lacus.,10,919
920,Wolfy Drennan,Financial Analyst,Etiam faucibus cursus urna.,34,920
921,Brent Prover,Staff Scientist,Suspendisse potenti. Nullam porttitor lacus at turpis.,5,921
922,Coletta Hablet,Tax Accountant,"In est risus, auctor sed, tristique in, tempus sit amet, sem. Fusce consequat.",24,922
923,Zaneta Heenan,Geological Engineer,Ut tellus.,40,923
924,Ramonda Van der Krui,Budget/Accounting Analyst I,Praesent id massa id nisl venenatis lacinia. Aenean sit amet justo.,14,924
925,Lorraine Gheorghe,Data Coordiator,In hac habitasse platea dictumst.,38,925
926,Ban Huckerby,Pharmacist,Nunc rhoncus dui vel sem. Sed sagittis.,40,926
927,Rodie Tatham,Chemical Engineer,Aenean sit amet justo. Morbi ut odio.,1,927
928,Normie Glanville,Pharmacist,Sed accumsan felis.,35,928
929,Bevon Pennetta,Internal Auditor,Sed sagittis.,16,929
930,Nappie Neill,Developer I,Donec ut dolor.,9,930
931,Marney Paolini,Help Desk Technician,Ut tellus. Nulla ut erat id mauris vulputate elementum.,2,931
932,Leonidas Physick,Automation Specialist II,"Vestibulum ante ipsum primis in faucibus orci luctus et ultrices posuere cubilia Curae; Nulla dapibus dolor vel est. Donec odio justo, sollicitudin ut, suscipit a, feugiat et, eros.",24,932
933,Stinky Dillingham,Environmental Tech,Suspendisse potenti.,3,933
934,Misha Joris,Executive Secretary,Aliquam erat volutpat.,2,934
935,Ariadne Kilbane,Compensation Analyst,Nullam porttitor lacus at turpis. Donec posuere metus vitae ipsum.,10,935
936,Pepita Maxworthy,Computer Systems Analyst II,In hac habitasse platea dictumst.,10,936
937,Meggie Hatfull,Payment Adjustment Coordinator,Maecenas ut massa quis augue luctus tincidunt. Nulla mollis molestie lorem.,22,937
938,Rriocard Curman,VP Product Management,In hac habitasse platea dictumst. Etiam faucibus cursus urna.,39,938
939,Lia Buttrum,Community Outreach Specialist,Vestibulum sed magna at nunc commodo placerat. Praesent blandit.,39,939
940,Carolyne Cowdrey,Associate Professor,Nulla tellus. In sagittis dui vel nisl.,6,940
941,Whitby Chowne,Technical Writer,Duis mattis egestas metus. Aenean fermentum.,3,941
942,Ranna Lawlings,Assistant Manager,Aenean sit amet justo. Morbi ut odio.,25,942
943,Normand Fairlem,Internal Auditor,Donec quis orci eget orci vehicula condimentum. Curabitur in libero ut massa volutpat convallis.,31,943
944,Hynda Muschette,Assistant Manager,Quisque porta volutpat erat.,6,944
945,Noam Gaul,Developer I,"Cum sociis natoque penatibus et magnis dis parturient montes, nascetur ridiculus mus. Vivamus vestibulum sagittis sapien.",7,945
946,Blakeley Bibb,VP Quality Control,"Vestibulum ante ipsum primis in faucibus orci luctus et ultrices posuere cubilia Curae; Donec pharetra, magna vestibulum aliquet ultrices, erat tortor sollicitudin mi, sit amet lobortis sapien sapien non mi.",30,946
947,Hilton Danford,Software Test Engineer II,"Cum sociis natoque penatibus et magnis dis parturient montes, nascetur ridiculus mus. Etiam vel augue.",4,947
948,Dorian Littlejohns,Senior Editor,"Maecenas tristique, est et tempus semper, est quam pharetra magna, ac consequat metus sapien ut nunc.",25,948
949,Anne-corinne Covolini,Health Coach II,Integer non velit.,32,949
950,Adore Camilli,Senior Editor,"Integer aliquet, massa id lobortis convallis, tortor risus dapibus augue, vel accumsan tellus nisi eu orci.",36,950
951,Vasili Farrell,Product Engineer,Curabitur convallis. Duis consequat dui nec nisi volutpat eleifend.,8,951
952,Iago Heinicke,Software Consultant,Phasellus id sapien in sapien iaculis congue.,21,952
953,Shelley Jann,Mechanical Systems Engineer,Vestibulum ante ipsum primis in faucibus orci luctus et ultrices posuere cubilia Curae; Mauris viverra diam vitae quam. Suspendisse potenti.,13,953
954,Donielle Moynihan,Administrative Assistant I,Sed accumsan felis.,19,954
955,Terrijo Pairpoint,Biostatistician I,Proin at turpis a pede posuere nonummy. Integer non velit.,34,955
956,Benedict Josifovic,Junior Executive,"In hac habitasse platea dictumst. Aliquam augue quam, sollicitudin vitae, consectetuer eget, rutrum at, lorem.",15,956
957,Morena MacCostye,Senior Financial Analyst,Phasellus in felis.,35,957
958,Mendy Alfonso,Systems Administrator I,"Nullam orci pede, venenatis non, sodales sed, tincidunt eu, felis. Fusce posuere felis sed lacus.",11,958
959,Vernice Aps,Dental Hygienist,Duis bibendum.,12,959
960,Janessa Wilds,Automation Specialist I,"Integer pede justo, lacinia eget, tincidunt eget, tempus vel, pede. Morbi porttitor lorem id ligula.",12,960
961,Chris Bertolin,Community Outreach Specialist,Morbi non lectus. Aliquam sit amet diam in magna bibendum imperdiet.,17,961
962,Jeannette Esilmon,Systems Administrator II,Phasellus in felis.,10,962
963,Toby Cord,Budget/Accounting Analyst II,Nulla justo.,16,963
964,Sax Hodinton,Librarian,"Nam nulla. Integer pede justo, lacinia eget, tincidunt eget, tempus vel, pede.",9,964
965,Randell Greason,Systems Administrator IV,Nullam sit amet turpis elementum ligula vehicula consequat. Morbi a ipsum.,0,965
966,Shawnee Josef,Senior Editor,Nullam porttitor lacus at turpis.,30,966
967,Cob Canellas,Financial Advisor,Morbi non lectus. Aliquam sit amet diam in magna bibendum imperdiet.,4,967
968,Leonhard Rossi,Executive Secretary,Maecenas ut massa quis augue luctus tincidunt. Nulla mollis molestie lorem.,26,968
969,Kay MacAscaidh,Recruiter,"Vivamus vestibulum sagittis sapien. Cum sociis natoque penatibus et magnis dis parturient montes, nascetur ridiculus mus.",12,969
970,Kala Danbrook,Engineer I,Sed sagittis.,10,970
