id,ФИО,Должность,Специализация,Стаж,id_Repair_Station
1,Coletta Halward,Sales Representative,Cras non velit nec nisi vulputate nonummy.,20,1
2,Thorvald Lidgate,Media Manager I,"Duis bibendum, felis sed interdum venenatis, turpis enim blandit mi, in porttitor pede justo eu massa.",19,2
3,Morgen Gilhool,Cost Accountant,Maecenas ut massa quis augue luctus tincidunt. Nulla mollis molestie lorem.,37,3
4,Christoforo Jahnisch,Sales Associate,Suspendisse accumsan tortor quis turpis.,6,4
5,Rhetta Row,Director of Sales,"Phasellus id sapien in sapien iaculis congue. Vivamus metus arcu, adipiscing molestie, hendrerit at, vulputate vitae, nisl.",20,5
6,Erminia Bischop,Staff Scientist,"Mauris enim leo, rhoncus sed, vestibulum sit amet, cursus id, turpis.",27,6
7,Christie Juarez,Office Assistant IV,"Lorem ipsum dolor sit amet, consectetuer adipiscing elit.",0,7
8,Findlay Marcam,Engineer I,Praesent id massa id nisl venenatis lacinia. Aenean sit amet justo.,0,8
9,Alayne Bendik,Business Systems Development Analyst,In eleifend quam a odio.,29,9
10,Elisha Death,Desktop Support Technician,Suspendisse potenti.,36,10
11,Jody Tumayan,Structural Analysis Engineer,Cras in purus eu magna vulputate luctus.,32,11
12,Ulrike Coultass,Software Test Engineer II,"Vestibulum quam sapien, varius ut, blandit non, interdum in, ante.",34,12
13,Ceciley Allerton,Marketing Assistant,Vestibulum rutrum rutrum neque.,23,13
14,Willyt Sondland,Compensation Analyst,Integer ac leo. Pellentesque ultrices mattis odio.,3,14
15,Kearney D'Aeth,Budget/Accounting Analyst IV,"Curabitur in libero ut massa volutpat convallis. Morbi odio odio, elementum eu, interdum eu, tincidunt in, leo.",32,15
16,Laurie Bernot,Web Developer IV,Nunc nisl.,13,16
17,Jacquenetta Richardet,Occupational Therapist,"In hac habitasse platea dictumst. Aliquam augue quam, sollicitudin vitae, consectetuer eget, rutrum at, lorem.",25,17
18,Vinny Burren,Executive Secretary,"Mauris ullamcorper purus sit amet nulla. Quisque arcu libero, rutrum ac, lobortis vel, dapibus at, diam.",37,18
19,Amanda Gossage,Business Systems Development Analyst,"Curabitur in libero ut massa volutpat convallis. Morbi odio odio, elementum eu, interdum eu, tincidunt in, leo.",15,19
20,Candide Blacksland,Product Engineer,"Donec ut mauris eget massa tempor convallis. Nulla neque libero, convallis eget, eleifend luctus, ultricies eu, nibh.",4,20
21,Vivianne Laskey,Senior Quality Engineer,"Mauris enim leo, rhoncus sed, vestibulum sit amet, cursus id, turpis.",4,21
22,Vanna Sowood,Health Coach IV,Phasellus sit amet erat. Nulla tempus.,12,22
23,Hagan Oades,Teacher,Morbi non quam nec dui luctus rutrum. Nulla tellus.,22,23
24,Ulrika Uttridge,Dental Hygienist,Praesent blandit lacinia erat.,2,24
25,Gibb Kill,Office Assistant III,Maecenas tincidunt lacus at velit. Vivamus vel nulla eget eros elementum pellentesque.,38,25
26,Kathleen Classen,Office Assistant I,Suspendisse potenti. In eleifend quam a odio.,27,26
27,Yule Baillie,Quality Engineer,"Nam ultrices, libero non mattis pulvinar, nulla pede ullamcorper augue, a suscipit nulla elit ac nulla. Sed vel enim sit amet nunc viverra dapibus.",27,27
28,Maynard Mansell,Quality Engineer,"Integer pede justo, lacinia eget, tincidunt eget, tempus vel, pede.",39,28
29,Maria Roose,Help Desk Operator,Duis consequat dui nec nisi volutpat eleifend. Donec ut dolor.,9,29
30,Dana Baddow,Junior Executive,Vestibulum sed magna at nunc commodo placerat. Praesent blandit.,25,30
31,Dinny Heiner,Developer III,Nulla nisl. Nunc nisl.,26,31
32,Timothea Castellanos,Help Desk Operator,Vestibulum rutrum rutrum neque. Aenean auctor gravida sem.,11,32
33,Bent Maitland,Systems Administrator IV,Etiam justo. Etiam pretium iaculis justo.,3,33
34,Abel Carville,Food Chemist,Pellentesque viverra pede ac diam. Cras pellentesque volutpat dui.,25,34
35,Duncan Yannikov,Geological Engineer,Pellentesque viverra pede ac diam.,37,35
36,Cherilynn Andrat,Administrative Assistant II,Pellentesque eget nunc.,35,36
37,Rafaellle D'Agostino,VP Marketing,Aenean fermentum. Donec ut mauris eget massa tempor convallis.,1,37
38,Cecilio Simak,Systems Administrator II,"In tempor, turpis nec euismod scelerisque, quam turpis adipiscing lorem, vitae mattis nibh ligula nec sem. Duis aliquam convallis nunc.",38,38
39,Branden Chevolleau,Food Chemist,"Lorem ipsum dolor sit amet, consectetuer adipiscing elit.",38,39
40,Massimo Dowry,Programmer Analyst III,Duis at velit eu est congue elementum. In hac habitasse platea dictumst.,0,40
41,Beth Dirkin,Research Assistant I,"Quisque erat eros, viverra eget, congue eget, semper rutrum, nulla.",32,41
42,Lenora Heigl,Community Outreach Specialist,Nulla facilisi. Cras non velit nec nisi vulputate nonummy.,9,42
43,Simmonds Breydin,Research Nurse,Duis mattis egestas metus.,1,43
44,Cristian Brotherick,Tax Accountant,Maecenas pulvinar lobortis est. Phasellus sit amet erat.,37,44
45,Filbert Bjerkan,Software Test Engineer I,Phasellus in felis. Donec semper sapien a libero.,28,45
46,Dalia Thorrington,Occupational Therapist,Nulla tellus.,14,46
47,Elane Barradell,Accounting Assistant II,"Curabitur in libero ut massa volutpat convallis. Morbi odio odio, elementum eu, interdum eu, tincidunt in, leo.",30,47
48,Wilt Betho,Operator,Duis aliquam convallis nunc.,2,48
49,Stormi Casaccia,Clinical Specialist,Mauris lacinia sapien quis libero.,17,49
50,Dennie Sprowell,Chief Design Engineer,Integer a nibh. In quis justo.,3,50
51,Walliw Bwye,Help Desk Operator,Nunc purus. Phasellus in felis.,19,51
52,Inger Morville,Information Systems Manager,Proin eu mi.,1,52
53,Odetta Heinschke,Software Engineer II,Vestibulum ante ipsum primis in faucibus orci luctus et ultrices posuere cubilia Curae; Duis faucibus accumsan odio. Curabitur convallis.,19,53
54,Ugo Rainey,Civil Engineer,Aliquam erat volutpat. In congue.,37,54
55,Robert Limprecht,Business Systems Development Analyst,Phasellus sit amet erat.,30,55
56,Sancho Everleigh,Administrative Officer,Vivamus vel nulla eget eros elementum pellentesque.,0,56
57,Gabbi Vokes,VP Quality Control,Donec posuere metus vitae ipsum. Aliquam non mauris.,7,57
58,Bernard Pidcock,Sales Representative,"Nulla ac enim. In tempor, turpis nec euismod scelerisque, quam turpis adipiscing lorem, vitae mattis nibh ligula nec sem.",33,58
59,Webb Haig,Administrative Assistant III,Donec semper sapien a libero. Nam dui.,23,59
60,Xerxes Bagnell,Mechanical Systems Engineer,Morbi a ipsum. Integer a nibh.,17,60
61,Claudian Muddimer,Software Test Engineer II,Suspendisse potenti. In eleifend quam a odio.,14,61
62,Thaxter Willcocks,Teacher,"In blandit ultrices enim. Lorem ipsum dolor sit amet, consectetuer adipiscing elit.",25,62
63,Rozele Kynd,Office Assistant I,"Donec odio justo, sollicitudin ut, suscipit a, feugiat et, eros.",16,63
64,Ripley Neles,VP Sales,Nullam varius. Nulla facilisi.,1,64
65,Dex Dring,Quality Engineer,Proin at turpis a pede posuere nonummy. Integer non velit.,34,65
66,Arlyne Pauli,VP Marketing,Vestibulum sed magna at nunc commodo placerat. Praesent blandit.,31,66
67,Merola Tinn,Staff Accountant IV,"Duis ac nibh. Fusce lacus purus, aliquet at, feugiat non, pretium quis, lectus.",22,67
68,Norma Osmon,Statistician III,"Cras mi pede, malesuada in, imperdiet et, commodo vulputate, justo.",16,68
69,Cornall MacAnelley,Electrical Engineer,"Integer aliquet, massa id lobortis convallis, tortor risus dapibus augue, vel accumsan tellus nisi eu orci.",35,69
70,Sheridan Paling,Teacher,Nulla ut erat id mauris vulputate elementum. Nullam varius.,8,70
71,Manon D'Ambrogio,Technical Writer,Praesent blandit.,34,71
72,Sydel Whitta,Social Worker,Ut at dolor quis odio consequat varius.,14,72
73,Lannie Jelks,Environmental Tech,"In tempor, turpis nec euismod scelerisque, quam turpis adipiscing lorem, vitae mattis nibh ligula nec sem.",17,73
74,Aubree Tadd,Nurse Practicioner,"Donec odio justo, sollicitudin ut, suscipit a, feugiat et, eros. Vestibulum ac est lacinia nisi venenatis tristique.",33,74
75,Stephan Reaman,Geologist III,Nulla tellus.,28,75
76,Reeba Nibley,Assistant Professor,In sagittis dui vel nisl.,18,76
77,Paddy Dehmel,Administrative Assistant I,Aenean sit amet justo.,9,77
78,Charyl Autie,Director of Sales,Morbi porttitor lorem id ligula. Suspendisse ornare consequat lectus.,29,78
79,Eldridge Kightly,Health Coach IV,Phasellus sit amet erat. Nulla tempus.,40,79
80,Kara-lynn Paramore,Nurse,"Maecenas leo odio, condimentum id, luctus nec, molestie sed, justo. Pellentesque viverra pede ac diam.",5,80
81,Wald Truggian,Junior Executive,Nulla suscipit ligula in lacus.,39,81
82,Terri Clive,Associate Professor,Praesent blandit.,18,82
83,Cody Longmore,Civil Engineer,"Fusce posuere felis sed lacus. Morbi sem mauris, laoreet ut, rhoncus aliquet, pulvinar sed, nisl.",40,83
84,Marinna Danielsson,Web Designer II,Mauris sit amet eros.,29,84
85,Sherilyn Brimblecombe,Quality Engineer,Integer ac neque.,39,85
86,Paten Spring,Speech Pathologist,Mauris lacinia sapien quis libero. Nullam sit amet turpis elementum ligula vehicula consequat.,38,86
87,Mycah Moen,Assistant Manager,Quisque ut erat.,34,87
88,Marcile Rupert,Engineer IV,Nulla ut erat id mauris vulputate elementum.,11,88
89,Katerine Brobak,Account Executive,Etiam justo. Etiam pretium iaculis justo.,40,89
90,Retha Dodding,Administrative Officer,Praesent blandit lacinia erat. Vestibulum sed magna at nunc commodo placerat.,33,90
91,Johannah Lovelace,Professor,Curabitur at ipsum ac tellus semper interdum.,22,91
92,Valdemar Abdie,Payment Adjustment Coordinator,Morbi non lectus.,6,92
93,Tessy Windress,Analyst Programmer,"Donec odio justo, sollicitudin ut, suscipit a, feugiat et, eros.",20,93
94,Nolana Sedger,VP Product Management,Maecenas pulvinar lobortis est. Phasellus sit amet erat.,22,94
95,Linnet Tincknell,Financial Advisor,Mauris lacinia sapien quis libero. Nullam sit amet turpis elementum ligula vehicula consequat.,15,95
96,Blanche Abeau,Information Systems Manager,Suspendisse potenti.,23,96
97,Rici Sher,Environmental Specialist,Nullam molestie nibh in lectus. Pellentesque at nulla.,21,97
98,Darleen Frackiewicz,Marketing Manager,Quisque id justo sit amet sapien dignissim vestibulum.,9,98
99,Judie Dunbar,Environmental Tech,"Fusce posuere felis sed lacus. Morbi sem mauris, laoreet ut, rhoncus aliquet, pulvinar sed, nisl.",11,99
100,Farley Gregolotti,Compensation Analyst,Suspendisse potenti. Cras in purus eu magna vulputate luctus.,8,100
101,Karim Goodrick,Occupational Therapist,Aenean sit amet justo.,35,101
102,Becka Flatley,Environmental Tech,"Mauris ullamcorper purus sit amet nulla. Quisque arcu libero, rutrum ac, lobortis vel, dapibus at, diam.",22,102
103,Wilbur McKall,Desktop Support Technician,Nulla tellus.,30,103
104,Maybelle Stopp,Actuary,Morbi non quam nec dui luctus rutrum. Nulla tellus.,2,104
105,Nancie Dutch,Research Nurse,Nullam sit amet turpis elementum ligula vehicula consequat. Morbi a ipsum.,5,105
106,Joey Leynton,Senior Quality Engineer,"Donec odio justo, sollicitudin ut, suscipit a, feugiat et, eros. Vestibulum ac est lacinia nisi venenatis tristique.",20,106
107,Miguel Simounet,Structural Engineer,"Proin leo odio, porttitor id, consequat in, consequat ut, nulla. Sed accumsan felis.",11,107
108,Piggy Carnow,Software Engineer I,Quisque ut erat.,24,108
109,Gav Peppett,Environmental Specialist,Maecenas pulvinar lobortis est. Phasellus sit amet erat.,30,109
110,Doe Chandler,Web Developer III,"Nulla ac enim. In tempor, turpis nec euismod scelerisque, quam turpis adipiscing lorem, vitae mattis nibh ligula nec sem.",20,110
111,Alikee Barrett,Automation Specialist IV,In hac habitasse platea dictumst.,23,111
112,Pall Covendon,Tax Accountant,Donec posuere metus vitae ipsum. Aliquam non mauris.,22,112
113,Sibilla Kurten,VP Sales,Aenean sit amet justo. Morbi ut odio.,22,113
114,Odele Causey,Environmental Tech,Aliquam erat volutpat. In congue.,5,114
115,Nelie Ludman,Internal Auditor,Nunc rhoncus dui vel sem.,30,115
116,Dallas Bahia,Automation Specialist II,"Nam congue, risus semper porta volutpat, quam pede lobortis ligula, sit amet eleifend pede libero quis orci.",14,116
117,Denver Musso,VP Marketing,Donec ut dolor. Morbi vel lectus in quam fringilla rhoncus.,11,117
118,Leland Barlie,Clinical Specialist,Pellentesque eget nunc.,11,118
119,Filmore Deners,Marketing Assistant,"In hac habitasse platea dictumst. Aliquam augue quam, sollicitudin vitae, consectetuer eget, rutrum at, lorem.",13,119
120,Orelie Buddington,Web Designer IV,Aliquam erat volutpat. In congue.,19,120
121,Donavon Bamell,Web Developer III,"Morbi sem mauris, laoreet ut, rhoncus aliquet, pulvinar sed, nisl. Nunc rhoncus dui vel sem.",0,121
122,Di Murrell,Registered Nurse,Suspendisse potenti.,18,122
123,Denney Godsal,Recruiter,Proin eu mi.,26,123
124,Swen Hartzenberg,Marketing Manager,Quisque id justo sit amet sapien dignissim vestibulum. Vestibulum ante ipsum primis in faucibus orci luctus et ultrices posuere cubilia Curae; Nulla dapibus dolor vel est.,38,124
125,Raquela Trevain,Research Associate,Maecenas rhoncus aliquam lacus. Morbi quis tortor id nulla ultrices aliquet.,34,125
126,Jordon Hucke,Assistant Manager,Morbi vel lectus in quam fringilla rhoncus.,23,126
127,Kele Weedenburg,Senior Financial Analyst,Etiam pretium iaculis justo.,21,127
128,Shaun Kopelman,Automation Specialist II,In eleifend quam a odio. In hac habitasse platea dictumst.,36,128
129,Nickolai Berrill,Safety Technician II,Maecenas ut massa quis augue luctus tincidunt.,27,129
130,Adrian Cruttenden,Programmer Analyst IV,Donec semper sapien a libero. Nam dui.,27,130
131,Bryna Ginity,Quality Control Specialist,Nulla tellus.,32,131
132,Allix Childerley,Operator,Vestibulum rutrum rutrum neque. Aenean auctor gravida sem.,28,132
133,Hephzibah Bascomb,Account Coordinator,Aenean fermentum. Donec ut mauris eget massa tempor convallis.,21,133
134,Ludovika Wink,Chemical Engineer,"Vestibulum ac est lacinia nisi venenatis tristique. Fusce congue, diam id ornare imperdiet, sapien urna pretium nisl, ut volutpat sapien arcu sed augue.",0,134
135,Hobart Gourlay,Sales Representative,In quis justo.,4,135
136,Carilyn Turville,Safety Technician IV,Pellentesque eget nunc. Donec quis orci eget orci vehicula condimentum.,4,136
137,Ramsey Leeuwerink,Help Desk Operator,In hac habitasse platea dictumst. Maecenas ut massa quis augue luctus tincidunt.,0,137
138,Collette Ruselin,Programmer Analyst IV,Morbi vel lectus in quam fringilla rhoncus.,21,138
139,Blakelee Enser,Research Nurse,Ut tellus. Nulla ut erat id mauris vulputate elementum.,15,139
140,Caleb Cadreman,Financial Analyst,Suspendisse potenti. In eleifend quam a odio.,2,140
141,Robena Shilito,Biostatistician I,Pellentesque at nulla. Suspendisse potenti.,34,141
142,Celle Caramuscia,Recruiting Manager,Integer tincidunt ante vel ipsum.,6,142
143,Vanya Gavaran,Structural Engineer,Vestibulum ante ipsum primis in faucibus orci luctus et ultrices posuere cubilia Curae; Mauris viverra diam vitae quam.,0,143
144,Mac Sarginson,Cost Accountant,Aliquam non mauris.,17,144
145,Kari Delatour,Health Coach III,Aenean lectus. Pellentesque eget nunc.,21,145
146,Harwilll Doick,Health Coach II,Duis bibendum.,33,146
147,Marion Baxandall,Recruiting Manager,"Morbi vestibulum, velit id pretium iaculis, diam erat fermentum justo, nec condimentum neque sapien placerat ante.",13,147
148,Wanda Goodliffe,Assistant Professor,Praesent blandit.,18,148
149,Roselin Noar,Budget/Accounting Analyst IV,Suspendisse potenti.,35,149
150,Ferne Mayger,Environmental Specialist,Nulla justo. Aliquam quis turpis eget elit sodales scelerisque.,12,150
151,Terrye Marrable,Operator,In quis justo.,8,151
152,Augie Wethers,Speech Pathologist,Proin interdum mauris non ligula pellentesque ultrices.,13,152
153,Katy Bunworth,Statistician IV,Nulla ut erat id mauris vulputate elementum. Nullam varius.,16,153
154,Lorne Immer,Junior Executive,Duis bibendum. Morbi non quam nec dui luctus rutrum.,23,154
155,Layne Pharaoh,GIS Technical Architect,In eleifend quam a odio. In hac habitasse platea dictumst.,22,155
156,Jenny McIlraith,Executive Secretary,Morbi vel lectus in quam fringilla rhoncus.,26,156
157,Percival Jones,Media Manager I,Nulla tempus. Vivamus in felis eu sapien cursus vestibulum.,13,157
158,Alene Raulin,Human Resources Assistant IV,Nullam porttitor lacus at turpis.,29,158
159,Cynde Rollitt,Mechanical Systems Engineer,"Duis ac nibh. Fusce lacus purus, aliquet at, feugiat non, pretium quis, lectus.",27,159
160,Briney Carbry,Physical Therapy Assistant,Pellentesque eget nunc. Donec quis orci eget orci vehicula condimentum.,32,160
161,Gilligan Causon,Human Resources Manager,"Nulla neque libero, convallis eget, eleifend luctus, ultricies eu, nibh.",26,161
162,Joell Brolechan,Biostatistician I,"Nullam orci pede, venenatis non, sodales sed, tincidunt eu, felis.",0,162
163,Tad Leiden,Sales Representative,"Cum sociis natoque penatibus et magnis dis parturient montes, nascetur ridiculus mus. Etiam vel augue.",33,163
164,Humbert Wynes,Research Associate,Donec quis orci eget orci vehicula condimentum.,6,164
165,Gaile Trask,Project Manager,Etiam pretium iaculis justo. In hac habitasse platea dictumst.,3,165
166,Federico Matts,Quality Engineer,"Lorem ipsum dolor sit amet, consectetuer adipiscing elit.",28,166
167,Alanna Reddle,Sales Associate,Aenean sit amet justo.,22,167
168,Rhea Sibun,Biostatistician II,Aliquam quis turpis eget elit sodales scelerisque. Mauris sit amet eros.,4,168
169,Anatola Chanter,Civil Engineer,Donec semper sapien a libero. Nam dui.,14,169
170,Verena Nutkins,Actuary,"Morbi sem mauris, laoreet ut, rhoncus aliquet, pulvinar sed, nisl.",10,170
171,Dorotea MacCartair,Structural Analysis Engineer,Vestibulum sed magna at nunc commodo placerat.,5,171
172,Alane Adhams,Marketing Manager,"Vivamus vestibulum sagittis sapien. Cum sociis natoque penatibus et magnis dis parturient montes, nascetur ridiculus mus.",12,172
173,Raye Danne,Automation Specialist IV,"Fusce lacus purus, aliquet at, feugiat non, pretium quis, lectus. Suspendisse potenti.",31,173
174,Duke Chitham,Senior Developer,"Morbi vestibulum, velit id pretium iaculis, diam erat fermentum justo, nec condimentum neque sapien placerat ante. Nulla justo.",2,174
175,Marylee Nuttall,Senior Quality Engineer,"Lorem ipsum dolor sit amet, consectetuer adipiscing elit.",23,175
176,Mort Forlong,Desktop Support Technician,Duis bibendum. Morbi non quam nec dui luctus rutrum.,23,176
177,Muffin Koeppke,Project Manager,Integer a nibh.,25,177
178,Ives Conybear,Dental Hygienist,Aliquam sit amet diam in magna bibendum imperdiet.,25,178
179,Izak McTiernan,Staff Accountant IV,In hac habitasse platea dictumst. Maecenas ut massa quis augue luctus tincidunt.,4,179
180,Olin Mulbry,Developer III,Duis aliquam convallis nunc.,13,180
181,Adrien McKimm,VP Product Management,Nulla justo.,35,181
182,Allissa Goady,VP Marketing,"Morbi vestibulum, velit id pretium iaculis, diam erat fermentum justo, nec condimentum neque sapien placerat ante. Nulla justo.",2,182
183,Lisetta Dymond,Recruiter,Vivamus tortor. Duis mattis egestas metus.,24,183
184,Tabitha Glanfield,Systems Administrator IV,Duis consequat dui nec nisi volutpat eleifend. Donec ut dolor.,30,184
185,Debera Caird,Community Outreach Specialist,Morbi non lectus. Aliquam sit amet diam in magna bibendum imperdiet.,13,185
186,Lia Hudd,Assistant Media Planner,"Cras in purus eu magna vulputate luctus. Cum sociis natoque penatibus et magnis dis parturient montes, nascetur ridiculus mus.",37,186
187,Philipa Westerman,Dental Hygienist,"Lorem ipsum dolor sit amet, consectetuer adipiscing elit.",14,187
188,Fred Roscher,Business Systems Development Analyst,Etiam justo.,34,188
189,Karen Wyrill,Research Associate,Integer ac leo.,18,189
190,Tallie Fayerbrother,Product Engineer,"Morbi vestibulum, velit id pretium iaculis, diam erat fermentum justo, nec condimentum neque sapien placerat ante. Nulla justo.",31,190
191,Nikolas Probets,Technical Writer,In hac habitasse platea dictumst.,18,191
192,Caro Kittel,VP Quality Control,Curabitur at ipsum ac tellus semper interdum.,36,192
193,Meridith Summerson,Director of Sales,Sed accumsan felis.,14,193
194,Phillipp Marchelli,Speech Pathologist,Aenean auctor gravida sem. Praesent id massa id nisl venenatis lacinia.,12,194
195,Johannes Plumb,Nurse,Etiam pretium iaculis justo. In hac habitasse platea dictumst.,27,195
196,Elnora Swyndley,VP Accounting,Mauris ullamcorper purus sit amet nulla.,27,196
197,Brig Tsarovic,Community Outreach Specialist,Morbi porttitor lorem id ligula. Suspendisse ornare consequat lectus.,4,197
198,Agnesse Sedgeman,Editor,Morbi ut odio.,21,198
199,Roxie Cramp,Accountant IV,Praesent id massa id nisl venenatis lacinia.,33,199
200,Ruben Percy,Biostatistician I,Suspendisse potenti. Cras in purus eu magna vulputate luctus.,25,200
201,Dannel Manssuer,Research Associate,Curabitur at ipsum ac tellus semper interdum. Mauris ullamcorper purus sit amet nulla.,34,201
202,Thorpe Giblin,Legal Assistant,Mauris lacinia sapien quis libero.,12,202
203,Marty Fuggles,Data Coordiator,Mauris sit amet eros. Suspendisse accumsan tortor quis turpis.,16,203
204,Vito Baddiley,Legal Assistant,Vestibulum ante ipsum primis in faucibus orci luctus et ultrices posuere cubilia Curae; Mauris viverra diam vitae quam. Suspendisse potenti.,28,204
205,Devi Grenter,Research Associate,Duis consequat dui nec nisi volutpat eleifend. Donec ut dolor.,16,205
206,Gavan Carnell,Human Resources Assistant III,"Fusce congue, diam id ornare imperdiet, sapien urna pretium nisl, ut volutpat sapien arcu sed augue. Aliquam erat volutpat.",10,206
207,Juliana Duffet,Programmer II,In quis justo.,34,207
208,Connie Jaegar,Compensation Analyst,"Vivamus metus arcu, adipiscing molestie, hendrerit at, vulputate vitae, nisl.",17,208
209,Dulci Roddie,Database Administrator IV,Aenean sit amet justo. Morbi ut odio.,20,209
210,Alfie Reason,Recruiting Manager,Proin risus.,13,210
211,Caresse Pennicott,Help Desk Operator,Proin risus.,32,211
212,Cymbre Whiteman,Senior Cost Accountant,"Nullam orci pede, venenatis non, sodales sed, tincidunt eu, felis.",29,212
213,Karel Wallsworth,Analog Circuit Design manager,"Lorem ipsum dolor sit amet, consectetuer adipiscing elit.",32,213
214,Benjamin Ruspine,Senior Financial Analyst,"Fusce posuere felis sed lacus. Morbi sem mauris, laoreet ut, rhoncus aliquet, pulvinar sed, nisl.",36,214
215,Haydon Ashbee,Dental Hygienist,Integer ac neque. Duis bibendum.,4,215
216,Bridie Tapsell,Financial Analyst,"Mauris enim leo, rhoncus sed, vestibulum sit amet, cursus id, turpis.",1,216
217,Nicolis Verney,Legal Assistant,In blandit ultrices enim.,17,217
218,Dennis Gadsdon,Assistant Media Planner,"Donec odio justo, sollicitudin ut, suscipit a, feugiat et, eros. Vestibulum ac est lacinia nisi venenatis tristique.",30,218
219,Sidnee Collicott,Technical Writer,Proin at turpis a pede posuere nonummy. Integer non velit.,24,219
220,Free MacLachlan,Community Outreach Specialist,In hac habitasse platea dictumst. Maecenas ut massa quis augue luctus tincidunt.,0,220
221,Kania Harlick,Chief Design Engineer,Nulla tellus.,10,221
222,Kristina Goodbody,Account Coordinator,Aliquam quis turpis eget elit sodales scelerisque.,6,222
223,Amberly Fyall,Information Systems Manager,Phasellus in felis.,40,223
224,Maudie Saleway,Quality Control Specialist,Morbi non quam nec dui luctus rutrum. Nulla tellus.,20,224
225,Delilah Gibbin,Nuclear Power Engineer,In blandit ultrices enim.,40,225
226,Gwenni Bootland,Senior Quality Engineer,Proin interdum mauris non ligula pellentesque ultrices.,19,226
227,Matthias Swindall,Accounting Assistant IV,Etiam justo. Etiam pretium iaculis justo.,34,227
228,Haily Luckin,Environmental Specialist,"Vestibulum ante ipsum primis in faucibus orci luctus et ultrices posuere cubilia Curae; Donec pharetra, magna vestibulum aliquet ultrices, erat tortor sollicitudin mi, sit amet lobortis sapien sapien non mi.",6,228
229,Eli Lintill,Executive Secretary,Aliquam erat volutpat.,38,229
230,Ulberto Eisig,VP Product Management,Maecenas tincidunt lacus at velit. Vivamus vel nulla eget eros elementum pellentesque.,16,230
231,Fonzie Killeley,Engineer III,Integer ac leo. Pellentesque ultrices mattis odio.,1,231
232,Mannie Toogood,Project Manager,Phasellus sit amet erat.,20,232
233,Benoite Broomhall,Recruiter,Morbi a ipsum.,20,233
234,Bran Hopfer,Structural Engineer,Donec vitae nisi.,19,234
235,Paco Shaylor,General Manager,Pellentesque viverra pede ac diam. Cras pellentesque volutpat dui.,38,235
236,Anstice Collecott,Graphic Designer,Morbi non lectus. Aliquam sit amet diam in magna bibendum imperdiet.,18,236
237,Matilda O'Spillane,Speech Pathologist,"Nulla neque libero, convallis eget, eleifend luctus, ultricies eu, nibh. Quisque id justo sit amet sapien dignissim vestibulum.",3,237
238,Jerrine Ubsdell,Marketing Assistant,Donec semper sapien a libero.,7,238
239,Carley Charter,Assistant Media Planner,Aenean lectus. Pellentesque eget nunc.,37,239
240,Chev Acreman,Dental Hygienist,Proin eu mi. Nulla ac enim.,26,240
241,Marcela Messent,Nuclear Power Engineer,Aliquam non mauris. Morbi non lectus.,9,241
242,Cindee Rushford,Marketing Assistant,"Quisque erat eros, viverra eget, congue eget, semper rutrum, nulla. Nunc purus.",1,242
243,Ceciley Hallin,Assistant Professor,Nulla tempus.,15,243
244,Nikki McCaughren,Financial Analyst,Morbi non lectus.,26,244
245,Cleo Wisham,Quality Engineer,Proin risus. Praesent lectus.,30,245
246,Clint Brownstein,Product Engineer,"Suspendisse ornare consequat lectus. In est risus, auctor sed, tristique in, tempus sit amet, sem.",0,246
247,Auroora Rowbottam,Legal Assistant,Proin at turpis a pede posuere nonummy. Integer non velit.,6,247
248,Merwin MacCarroll,Graphic Designer,Phasellus in felis.,4,248
249,Stephie Stathor,Speech Pathologist,Proin at turpis a pede posuere nonummy.,22,249
250,Farleigh Sacco,VP Marketing,"Nam dui. Proin leo odio, porttitor id, consequat in, consequat ut, nulla.",7,250
251,Olvan Rudolph,Research Associate,In eleifend quam a odio. In hac habitasse platea dictumst.,14,251
