id,ФИО,Должность,Специализация,Стаж,id_Repair_Station
252,Eda Gossage,Analyst Programmer,Curabitur at ipsum ac tellus semper interdum.,2,252
253,Cindie Heaven,Research Associate,Nulla mollis molestie lorem.,13,253
254,Waylan Heyfield,Registered Nurse,"Integer pede justo, lacinia eget, tincidunt eget, tempus vel, pede. Morbi porttitor lorem id ligula.",4,254
255,Jude Larose,Senior Financial Analyst,"Nam ultrices, libero non mattis pulvinar, nulla pede ullamcorper augue, a suscipit nulla elit ac nulla. Sed vel enim sit amet nunc viverra dapibus.",0,255
256,Flore Richter,Desktop Support Technician,Etiam justo. Etiam pretium iaculis justo.,11,256
257,Hill Masson,Senior Developer,In hac habitasse platea dictumst. Etiam faucibus cursus urna.,26,257
258,Milzie Lebrun,Desktop Support Technician,Curabitur gravida nisi at nibh. In hac habitasse platea dictumst.,34,258
259,Cathie Dreng,Web Developer III,Etiam pretium iaculis justo.,20,259
260,Aron Karim,Statistician IV,Cras in purus eu magna vulputate luctus.,30,260
261,Delilah Tomini,Administrative Officer,In hac habitasse platea dictumst. Maecenas ut massa quis augue luctus tincidunt.,35,261
262,Bessy Averall,Registered Nurse,Donec vitae nisi.,28,262
263,Lyle Greenhall,Information Systems Manager,Integer a nibh.,16,263
264,Worthy Ionnisian,VP Marketing,Vivamus vestibulum sagittis sapien.,40,264
265,Albrecht Loisi,Geologist I,Vestibulum ante ipsum primis in faucibus orci luctus et ultrices posuere cubilia Curae; Duis faucibus accumsan odio. Curabitur convallis.,31,265
266,Cassy Lutman,Senior Cost Accountant,Proin risus. Praesent lectus.,13,266
267,Hall Massimi,Senior Developer,Integer ac neque.,20,267
268,Elmore Thalmann,Electrical Engineer,In congue.,37,268
269,Ivonne Sworn,Budget/Accounting Analyst III,"In est risus, auctor sed, tristique in, tempus sit amet, sem.",12,269
270,Meghan MacCollom,Mechanical Systems Engineer,"Maecenas tristique, est et tempus semper, est quam pharetra magna, ac consequat metus sapien ut nunc. Vestibulum ante ipsum primis in faucibus orci luctus et ultrices posuere cubilia Curae; Mauris viverra diam vitae quam.",40,270
271,Leonid Gretton,GIS Technical Architect,"Morbi sem mauris, laoreet ut, rhoncus aliquet, pulvinar sed, nisl. Nunc rhoncus dui vel sem.",4,271
272,Tomaso Sayle,Chemical Engineer,"Morbi odio odio, elementum eu, interdum eu, tincidunt in, leo.",35,272
273,Jethro Bolgar,Compensation Analyst,Fusce consequat.,31,273
274,Rosalind Dorgon,Help Desk Operator,Nulla suscipit ligula in lacus. Curabitur at ipsum ac tellus semper interdum.,13,274
275,Ansell Ogelbe,Financial Analyst,Aliquam non mauris.,5,275
276,Hannah Buscher,Executive Secretary,In eleifend quam a odio. In hac habitasse platea dictumst.,16,276
277,Clarita Klulisek,Human Resources Manager,Donec semper sapien a libero.,32,277
278,Jo Seel,Quality Control Specialist,"Vivamus metus arcu, adipiscing molestie, hendrerit at, vulputate vitae, nisl. Aenean lectus.",9,278
279,Lucio Reding,Help Desk Technician,Vestibulum ac est lacinia nisi venenatis tristique.,20,279
280,Yvonne Thomsen,Marketing Manager,"Donec diam neque, vestibulum eget, vulputate ut, ultrices vel, augue. Vestibulum ante ipsum primis in faucibus orci luctus et ultrices posuere cubilia Curae; Donec pharetra, magna vestibulum aliquet ultrices, erat tortor sollicitudin mi, sit amet lobortis sapien sapien non mi.",20,280
281,Sheila Paszak,Structural Analysis Engineer,"Morbi quis tortor id nulla ultrices aliquet. Maecenas leo odio, condimentum id, luctus nec, molestie sed, justo.",33,281
282,Ryun Calbrathe,Web Designer IV,Fusce consequat. Nulla nisl.,25,282
283,Antoine Clay,Assistant Professor,Pellentesque ultrices mattis odio.,3,283
284,Rourke Stimpson,Staff Scientist,Aenean fermentum.,12,284
285,Tyne Ponton,Senior Developer,"Cras in purus eu magna vulputate luctus. Cum sociis natoque penatibus et magnis dis parturient montes, nascetur ridiculus mus.",22,285
286,Johny Copcott,Software Consultant,Duis at velit eu est congue elementum.,5,286
287,Deane Arrington,Information Systems Manager,Aenean lectus.,14,287
288,Stacy Copyn,Internal Auditor,Donec dapibus. Duis at velit eu est congue elementum.,23,288
289,Jammal McDonald,Cost Accountant,Sed ante. Vivamus tortor.,21,289
290,Lani De la Barre,Design Engineer,Donec semper sapien a libero. Nam dui.,37,290
291,Waldemar Carswell,Nurse,In hac habitasse platea dictumst.,33,291
292,Thomasin Fransinelli,Geologist IV,Nulla suscipit ligula in lacus.,30,292
293,Agnesse Harrell,Environmental Tech,Nulla mollis molestie lorem. Quisque ut erat.,40,293
294,Aretha Samweyes,Teacher,Vestibulum ante ipsum primis in faucibus orci luctus et ultrices posuere cubilia Curae; Nulla dapibus dolor vel est.,28,294
295,Chilton Frudd,Assistant Manager,Fusce consequat.,0,295
296,Birch Sibbson,Associate Professor,Donec vitae nisi.,16,296
297,Rosalynd Clewarth,Legal Assistant,Phasellus in felis. Donec semper sapien a libero.,32,297
298,Reiko Bould,VP Marketing,In blandit ultrices enim.,28,298
299,Emilie Colledge,Technical Writer,"Proin leo odio, porttitor id, consequat in, consequat ut, nulla.",7,299
300,Alyse Carren,Senior Quality Engineer,Donec vitae nisi.,8,300
301,Flor Vasiltsov,Environmental Specialist,"Vivamus vestibulum sagittis sapien. Cum sociis natoque penatibus et magnis dis parturient montes, nascetur ridiculus mus.",19,301
302,Goldia Masdon,Graphic Designer,Donec posuere metus vitae ipsum.,34,302
303,Jehu Petrescu,Research Assistant II,Ut at dolor quis odio consequat varius.,37,303
304,Leslie Twiggins,Compensation Analyst,Phasellus id sapien in sapien iaculis congue.,24,304
305,Mozes Alexandrou,Assistant Manager,Nulla facilisi. Cras non velit nec nisi vulputate nonummy.,36,305
306,Morna Loreit,Sales Associate,Ut at dolor quis odio consequat varius. Integer ac leo.,3,306
307,Ashli Sandbatch,Dental Hygienist,"In est risus, auctor sed, tristique in, tempus sit amet, sem. Fusce consequat.",25,307
308,Merwyn Solman,Information Systems Manager,"Integer pede justo, lacinia eget, tincidunt eget, tempus vel, pede. Morbi porttitor lorem id ligula.",8,308
309,Odelle Minget,Media Manager II,Integer ac neque.,13,309
310,Ulrike Doorbar,Executive Secretary,Ut at dolor quis odio consequat varius.,23,310
311,Blanca Excell,Analog Circuit Design manager,In eleifend quam a odio.,8,311
312,Lek Cestard,Database Administrator I,Morbi porttitor lorem id ligula.,2,312
313,Lorrie Jeffreys,Occupational Therapist,"Nunc nisl. Duis bibendum, felis sed interdum venenatis, turpis enim blandit mi, in porttitor pede justo eu massa.",12,313
314,Corbett Olin,Information Systems Manager,In congue.,11,314
315,Timmy Menel,Design Engineer,Nam dui.,32,315
316,Sim Chapman,Design Engineer,"Nam congue, risus semper porta volutpat, quam pede lobortis ligula, sit amet eleifend pede libero quis orci.",3,316
317,Riley Agates,Chief Design Engineer,"In est risus, auctor sed, tristique in, tempus sit amet, sem. Fusce consequat.",30,317
318,Jimmie Bachelar,Senior Cost Accountant,"Donec diam neque, vestibulum eget, vulputate ut, ultrices vel, augue. Vestibulum ante ipsum primis in faucibus orci luctus et ultrices posuere cubilia Curae; Donec pharetra, magna vestibulum aliquet ultrices, erat tortor sollicitudin mi, sit amet lobortis sapien sapien non mi.",2,318
319,Cly Northam,Help Desk Technician,"Nam congue, risus semper porta volutpat, quam pede lobortis ligula, sit amet eleifend pede libero quis orci. Nullam molestie nibh in lectus.",36,319
320,Christoffer Rubenov,Nurse Practicioner,Proin risus.,30,320
321,Calley Vigneron,Payment Adjustment Coordinator,Aliquam erat volutpat. In congue.,27,321
322,Marcos Longcake,Nurse,"Aliquam augue quam, sollicitudin vitae, consectetuer eget, rutrum at, lorem.",11,322
323,Raff Dimitriou,Web Designer I,"Vivamus vestibulum sagittis sapien. Cum sociis natoque penatibus et magnis dis parturient montes, nascetur ridiculus mus.",29,323
324,Gib O'Hartigan,Accounting Assistant II,Vestibulum rutrum rutrum neque.,25,324
325,Magdalen Hymas,Account Executive,Nulla justo. Aliquam quis turpis eget elit sodales scelerisque.,19,325
326,Connie Kitchingman,Data Coordiator,"Vestibulum ac est lacinia nisi venenatis tristique. Fusce congue, diam id ornare imperdiet, sapien urna pretium nisl, ut volutpat sapien arcu sed augue.",9,326
327,Erica Aylott,Actuary,Sed vel enim sit amet nunc viverra dapibus. Nulla suscipit ligula in lacus.,24,327
328,Obidiah Ager,Developer IV,Integer ac neque.,2,328
329,Carree Fright,Programmer Analyst IV,In sagittis dui vel nisl. Duis ac nibh.,17,329
330,Aili Ricciardelli,Actuary,"Vivamus metus arcu, adipiscing molestie, hendrerit at, vulputate vitae, nisl. Aenean lectus.",40,330
331,Staci Pitone,Desktop Support Technician,In congue. Etiam justo.,32,331
332,Darline Cavilla,Health Coach IV,"Lorem ipsum dolor sit amet, consectetuer adipiscing elit. Proin risus.",32,332
333,Arnaldo Brodbin,Nurse Practicioner,Vivamus in felis eu sapien cursus vestibulum.,36,333
334,Lexis Wevell,Account Representative I,"Nam ultrices, libero non mattis pulvinar, nulla pede ullamcorper augue, a suscipit nulla elit ac nulla.",32,334
335,Odie Whenman,General Manager,Nulla tellus.,18,335
336,Eleanora Devenish,Accountant II,Maecenas rhoncus aliquam lacus. Morbi quis tortor id nulla ultrices aliquet.,19,336
337,Franklin Faucherand,Nuclear Power Engineer,Vestibulum rutrum rutrum neque.,3,337
338,Jordain Burchett,VP Marketing,Morbi porttitor lorem id ligula.,29,338
339,Sephira Suggitt,Cost Accountant,"In tempor, turpis nec euismod scelerisque, quam turpis adipiscing lorem, vitae mattis nibh ligula nec sem.",12,339
340,Renata Antram,Budget/Accounting Analyst IV,"Quisque arcu libero, rutrum ac, lobortis vel, dapibus at, diam. Nam tristique tortor eu pede.",22,340
341,Dionysus Karpeev,Chief Design Engineer,Sed vel enim sit amet nunc viverra dapibus.,26,341
342,Frederick Penk,Media Manager II,Cras non velit nec nisi vulputate nonummy. Maecenas tincidunt lacus at velit.,3,342
343,Yelena Berzins,Director of Sales,Curabitur in libero ut massa volutpat convallis.,6,343
344,Yank Mazzia,Occupational Therapist,Integer a nibh. In quis justo.,26,344
345,Felipa Romand,Food Chemist,Aenean fermentum. Donec ut mauris eget massa tempor convallis.,15,345
346,Christi D'Arrigo,Engineer II,Pellentesque at nulla.,40,346
347,Brande Mc Carroll,Geological Engineer,Suspendisse potenti. Cras in purus eu magna vulputate luctus.,29,347
348,Jackquelin McQuorkell,Graphic Designer,Morbi porttitor lorem id ligula.,2,348
349,Kym Klassmann,VP Quality Control,"In est risus, auctor sed, tristique in, tempus sit amet, sem. Fusce consequat.",1,349
350,Karlan Daine,Data Coordiator,Vestibulum ante ipsum primis in faucibus orci luctus et ultrices posuere cubilia Curae; Mauris viverra diam vitae quam. Suspendisse potenti.,5,350
351,Renaud Horley,Quality Engineer,Suspendisse accumsan tortor quis turpis.,1,351
352,Horace Betteson,Nurse,Nulla facilisi. Cras non velit nec nisi vulputate nonummy.,25,352
353,Ethelin Nolot,Research Associate,Fusce consequat.,11,353
354,Keven Annatt,Design Engineer,"In est risus, auctor sed, tristique in, tempus sit amet, sem. Fusce consequat.",40,354
355,Eleen Chicotti,Marketing Assistant,Integer ac neque.,26,355
356,Chaunce Bramsen,Staff Accountant I,"Fusce congue, diam id ornare imperdiet, sapien urna pretium nisl, ut volutpat sapien arcu sed augue. Aliquam erat volutpat.",31,356
357,Dorrie Iddon,Analyst Programmer,Quisque id justo sit amet sapien dignissim vestibulum. Vestibulum ante ipsum primis in faucibus orci luctus et ultrices posuere cubilia Curae; Nulla dapibus dolor vel est.,0,357
358,Hatti Stoyell,Programmer Analyst III,"Vestibulum ante ipsum primis in faucibus orci luctus et ultrices posuere cubilia Curae; Nulla dapibus dolor vel est. Donec odio justo, sollicitudin ut, suscipit a, feugiat et, eros.",18,358
359,Guenevere Black,Junior Executive,"Vestibulum ac est lacinia nisi venenatis tristique. Fusce congue, diam id ornare imperdiet, sapien urna pretium nisl, ut volutpat sapien arcu sed augue.",21,359
360,Renae Clewarth,Dental Hygienist,Donec dapibus.,0,360
361,Lara Sotheby,Software Consultant,Nullam porttitor lacus at turpis. Donec posuere metus vitae ipsum.,6,361
362,Charlotta Miko,Legal Assistant,Nunc purus.,30,362
363,Susy Waterson,Compensation Analyst,In eleifend quam a odio.,3,363
364,Rafaello Eggerton,Software Test Engineer III,"Nulla neque libero, convallis eget, eleifend luctus, ultricies eu, nibh. Quisque id justo sit amet sapien dignissim vestibulum.",21,364
365,Collin Terris,Developer I,Morbi vel lectus in quam fringilla rhoncus.,18,365
366,Kevin Kulic,Quality Engineer,Suspendisse accumsan tortor quis turpis.,30,366
367,Flin Decort,Computer Systems Analyst I,Vivamus in felis eu sapien cursus vestibulum.,37,367
368,Federica Lidgertwood,Registered Nurse,"Mauris ullamcorper purus sit amet nulla. Quisque arcu libero, rutrum ac, lobortis vel, dapibus at, diam.",6,368
369,Barry Bradman,Director of Sales,Nulla tempus. Vivamus in felis eu sapien cursus vestibulum.,28,369
370,Gwendolyn Hulkes,Dental Hygienist,Phasellus id sapien in sapien iaculis congue.,4,370
371,Dominic Summerly,Accounting Assistant III,Aenean fermentum.,24,371
372,Russ Spare,Help Desk Operator,"In hac habitasse platea dictumst. Aliquam augue quam, sollicitudin vitae, consectetuer eget, rutrum at, lorem.",8,372
373,Garret Morch,Analyst Programmer,"Duis bibendum, felis sed interdum venenatis, turpis enim blandit mi, in porttitor pede justo eu massa.",31,373
374,Sunny Walters,Mechanical Systems Engineer,"Fusce posuere felis sed lacus. Morbi sem mauris, laoreet ut, rhoncus aliquet, pulvinar sed, nisl.",39,374
375,Selinda MacChaell,Electrical Engineer,Integer a nibh.,9,375
376,Ulrica Normanville,Software Test Engineer IV,Integer tincidunt ante vel ipsum. Praesent blandit lacinia erat.,6,376
377,Cecilia Castelow,Sales Representative,Sed accumsan felis. Ut at dolor quis odio consequat varius.,33,377
378,Lemmie O'Loughane,Budget/Accounting Analyst I,In quis justo.,16,378
379,Bridget Womersley,Chief Design Engineer,Vivamus vel nulla eget eros elementum pellentesque.,27,379
380,Violante Bourley,Recruiting Manager,Morbi a ipsum. Integer a nibh.,2,380
381,Ange Woolmore,Assistant Manager,In eleifend quam a odio.,1,381
382,Matthias Sturges,Programmer III,Suspendisse accumsan tortor quis turpis.,10,382
383,Sheree Domone,Mechanical Systems Engineer,"Cras pellentesque volutpat dui. Maecenas tristique, est et tempus semper, est quam pharetra magna, ac consequat metus sapien ut nunc.",38,383
384,Sibelle Mucklestone,Operator,In hac habitasse platea dictumst. Etiam faucibus cursus urna.,37,384
385,Orelie Aspey,Geologist III,"Maecenas leo odio, condimentum id, luctus nec, molestie sed, justo. Pellentesque viverra pede ac diam.",6,385
386,Will Statham,Community Outreach Specialist,"Integer non velit. Donec diam neque, vestibulum eget, vulputate ut, ultrices vel, augue.",2,386
387,Gianina Jillett,Programmer Analyst I,Vestibulum ante ipsum primis in faucibus orci luctus et ultrices posuere cubilia Curae; Mauris viverra diam vitae quam.,30,387
388,Salomo Bawme,Programmer Analyst III,Duis aliquam convallis nunc.,5,388
389,Mallory Maryan,Design Engineer,"Mauris enim leo, rhoncus sed, vestibulum sit amet, cursus id, turpis.",8,389
390,Ruben Veale,Staff Accountant I,"Duis ac nibh. Fusce lacus purus, aliquet at, feugiat non, pretium quis, lectus.",23,390
391,Marybelle Wallege,Programmer II,"Lorem ipsum dolor sit amet, consectetuer adipiscing elit. Proin risus.",20,391
392,Suzette Moughton,Financial Advisor,In hac habitasse platea dictumst.,26,392
393,Aubrie Challoner,Professor,"Suspendisse ornare consequat lectus. In est risus, auctor sed, tristique in, tempus sit amet, sem.",15,393
394,Tab Iglesias,Payment Adjustment Coordinator,Etiam pretium iaculis justo. In hac habitasse platea dictumst.,11,394
395,Vaughn Sommerfeld,Social Worker,"Curabitur in libero ut massa volutpat convallis. Morbi odio odio, elementum eu, interdum eu, tincidunt in, leo.",35,395
396,Arlen Passion,Dental Hygienist,Nulla tempus. Vivamus in felis eu sapien cursus vestibulum.,30,396
397,Freddy Lanfere,Research Associate,"Vivamus metus arcu, adipiscing molestie, hendrerit at, vulputate vitae, nisl. Aenean lectus.",14,397
398,Pauline Metham,Junior Executive,"Nullam orci pede, venenatis non, sodales sed, tincidunt eu, felis. Fusce posuere felis sed lacus.",16,398
399,Alleyn Parade,Help Desk Technician,Mauris ullamcorper purus sit amet nulla.,17,399
400,Archie Jex,Nurse,Aliquam quis turpis eget elit sodales scelerisque.,10,400
401,Kassandra Minifie,Clinical Specialist,Phasellus in felis.,35,401
402,Emilee Leathart,Software Consultant,Sed ante. Vivamus tortor.,5,402
403,Syman Issatt,Nuclear Power Engineer,"Praesent lectus. Vestibulum quam sapien, varius ut, blandit non, interdum in, ante.",13,403
404,Hogan Wingatt,Civil Engineer,Sed vel enim sit amet nunc viverra dapibus. Nulla suscipit ligula in lacus.,29,404
405,Park Levins,Desktop Support Technician,"Cum sociis natoque penatibus et magnis dis parturient montes, nascetur ridiculus mus. Etiam vel augue.",22,405
406,Colin McCaughey,Web Developer III,Vivamus vestibulum sagittis sapien.,20,406
407,Carlie Zelner,Sales Representative,Curabitur at ipsum ac tellus semper interdum. Mauris ullamcorper purus sit amet nulla.,32,407
408,Sydel Limbrick,Sales Associate,In eleifend quam a odio.,31,408
409,Olympe Szymanek,Analog Circuit Design manager,Vestibulum ante ipsum primis in faucibus orci luctus et ultrices posuere cubilia Curae; Duis faucibus accumsan odio. Curabitur convallis.,23,409
410,Davin Harrington,Assistant Manager,Etiam vel augue. Vestibulum rutrum rutrum neque.,16,410
411,Elli Scotchford,Human Resources Assistant IV,"Nulla neque libero, convallis eget, eleifend luctus, ultricies eu, nibh.",13,411
412,Sheela Jardein,Librarian,"In blandit ultrices enim. Lorem ipsum dolor sit amet, consectetuer adipiscing elit.",39,412
413,Edin Limbourne,Systems Administrator II,Morbi ut odio.,7,413
414,Sherline Jenking,Sales Associate,Morbi non lectus. Aliquam sit amet diam in magna bibendum imperdiet.,18,414
415,Catlaina Loveland,Business Systems Development Analyst,"Proin leo odio, porttitor id, consequat in, consequat ut, nulla. Sed accumsan felis.",15,415
416,Bartholomeo Ponceford,Speech Pathologist,Nam tristique tortor eu pede.,3,416
417,Cheri Prazor,Physical Therapy Assistant,Vestibulum ac est lacinia nisi venenatis tristique.,19,417
418,Eda Ruffey,Associate Professor,Suspendisse potenti.,33,418
419,Fawnia Sherer,Cost Accountant,In sagittis dui vel nisl.,33,419
420,Aaron Duignan,Community Outreach Specialist,Nullam porttitor lacus at turpis.,10,420
421,Tracee Barks,Community Outreach Specialist,"Vivamus metus arcu, adipiscing molestie, hendrerit at, vulputate vitae, nisl.",32,421
422,Matt Copson,Accounting Assistant IV,Vivamus vestibulum sagittis sapien.,12,422
423,Gus Quickenden,Analog Circuit Design manager,"Nam ultrices, libero non mattis pulvinar, nulla pede ullamcorper augue, a suscipit nulla elit ac nulla. Sed vel enim sit amet nunc viverra dapibus.",39,423
424,Brose Critcher,Environmental Tech,Proin interdum mauris non ligula pellentesque ultrices. Phasellus id sapien in sapien iaculis congue.,3,424
425,Cordelie Olenichev,Human Resources Manager,In sagittis dui vel nisl. Duis ac nibh.,2,425
426,Eudora Klejna,Senior Cost Accountant,Ut at dolor quis odio consequat varius. Integer ac leo.,8,426
427,Bar Rosen,Sales Representative,Curabitur convallis.,25,427
428,Sybyl Gumbrell,Data Coordiator,"Proin leo odio, porttitor id, consequat in, consequat ut, nulla. Sed accumsan felis.",38,428
429,Nissa Skene,Operator,Integer a nibh.,36,429
430,Fleur Wallbank,Senior Developer,Praesent blandit lacinia erat.,33,430
431,Delainey Hirche,Senior Cost Accountant,Ut at dolor quis odio consequat varius. Integer ac leo.,18,431
432,Temple Carty,Director of Sales,"Morbi odio odio, elementum eu, interdum eu, tincidunt in, leo.",12,432
433,Frederico Caslane,Food Chemist,Maecenas tincidunt lacus at velit. Vivamus vel nulla eget eros elementum pellentesque.,11,433
434,Charlena Bambrugh,Developer III,Mauris sit amet eros.,27,434
435,Bank Feake,Staff Scientist,Donec semper sapien a libero.,29,435
436,Vinni Pasfield,VP Sales,"Vivamus vestibulum sagittis sapien. Cum sociis natoque penatibus et magnis dis parturient montes, nascetur ridiculus mus.",24,436
437,Emmery Lewson,Web Designer IV,Nulla tellus. In sagittis dui vel nisl.,4,437
438,Zach Rosevear,Senior Editor,Vestibulum sed magna at nunc commodo placerat.,22,438
439,Gayle Raffon,Technical Writer,Duis mattis egestas metus. Aenean fermentum.,25,439
440,Nicolais Gouly,Product Engineer,Suspendisse ornare consequat lectus.,17,440
441,Jacquenetta Anselm,Assistant Manager,Integer ac leo. Pellentesque ultrices mattis odio.,2,441
442,Harbert Greenland,Database Administrator II,Etiam justo. Etiam pretium iaculis justo.,20,442
443,Gerry Turnpenny,Health Coach III,"Proin leo odio, porttitor id, consequat in, consequat ut, nulla.",33,443
444,Nanette Adamoli,Structural Analysis Engineer,Integer ac leo. Pellentesque ultrices mattis odio.,1,444
445,Blakeley Thomkins,Technical Writer,"Phasellus id sapien in sapien iaculis congue. Vivamus metus arcu, adipiscing molestie, hendrerit at, vulputate vitae, nisl.",25,445
446,Marwin Bees,Recruiter,"Morbi sem mauris, laoreet ut, rhoncus aliquet, pulvinar sed, nisl.",25,446
447,Free Blaw,Help Desk Operator,Nunc nisl.,4,447
448,Collette Roll,Structural Analysis Engineer,"In hac habitasse platea dictumst. Morbi vestibulum, velit id pretium iaculis, diam erat fermentum justo, nec condimentum neque sapien placerat ante.",17,448
449,Garwood Cobleigh,Analyst Programmer,Vivamus in felis eu sapien cursus vestibulum.,8,449
450,Nerti Gadsby,Safety Technician I,Vestibulum ante ipsum primis in faucibus orci luctus et ultrices posuere cubilia Curae; Nulla dapibus dolor vel est.,26,450
451,Melody Penrose,Budget/Accounting Analyst I,Donec semper sapien a libero. Nam dui.,15,451
452,Horace Basindale,Staff Accountant IV,"Integer aliquet, massa id lobortis convallis, tortor risus dapibus augue, vel accumsan tellus nisi eu orci. Mauris lacinia sapien quis libero.",0,452
453,Orton Gammons,Design Engineer,"Mauris ullamcorper purus sit amet nulla. Quisque arcu libero, rutrum ac, lobortis vel, dapibus at, diam.",38,453
454,Felike Lillecrop,Librarian,Vivamus vestibulum sagittis sapien.,37,454
455,Anabelle Lingner,Design Engineer,Cras in purus eu magna vulputate luctus.,5,455
456,Lewie Simunek,Payment Adjustment Coordinator,"Quisque arcu libero, rutrum ac, lobortis vel, dapibus at, diam. Nam tristique tortor eu pede.",3,456
457,Wendy Desbrow,Nurse Practicioner,Donec vitae nisi.,4,457
458,Berkly Bruhn,Food Chemist,Vestibulum ante ipsum primis in faucibus orci luctus et ultrices posuere cubilia Curae; Duis faucibus accumsan odio.,10,458
459,Sylas Santo,Automation Specialist IV,Praesent lectus.,7,459
460,Ruperta Degenhardt,Internal Auditor,"Proin leo odio, porttitor id, consequat in, consequat ut, nulla.",21,460
461,Nicolle Pittson,Paralegal,Curabitur at ipsum ac tellus semper interdum. Mauris ullamcorper purus sit amet nulla.,7,461
462,Ermanno De Maria,GIS Technical Architect,Nulla ac enim.,33,462
463,Sabrina Willsmore,Cost Accountant,Pellentesque viverra pede ac diam. Cras pellentesque volutpat dui.,10,463
464,Dionne McManamon,Compensation Analyst,"Donec odio justo, sollicitudin ut, suscipit a, feugiat et, eros. Vestibulum ac est lacinia nisi venenatis tristique.",28,464
465,Millard Lempke,Database Administrator III,Nulla mollis molestie lorem.,29,465
466,Terrell Risbridge,Structural Engineer,"Morbi sem mauris, laoreet ut, rhoncus aliquet, pulvinar sed, nisl. Nunc rhoncus dui vel sem.",29,466
467,Trudy Jordan,Administrative Officer,"Duis ac nibh. Fusce lacus purus, aliquet at, feugiat non, pretium quis, lectus.",2,467
468,Flossy Baldung,Engineer I,"Praesent lectus. Vestibulum quam sapien, varius ut, blandit non, interdum in, ante.",39,468
469,Care Habbon,Senior Financial Analyst,Morbi a ipsum.,13,469
470,Sheela Burchfield,Director of Sales,"In blandit ultrices enim. Lorem ipsum dolor sit amet, consectetuer adipiscing elit.",35,470
471,Boycey Golt,Executive Secretary,Pellentesque eget nunc.,15,471
472,Angelika Lambrick,GIS Technical Architect,Proin eu mi.,32,472
473,Boone Olyonov,Cost Accountant,Ut tellus.,20,473
474,Mead Rosenstein,Senior Cost Accountant,"Suspendisse ornare consequat lectus. In est risus, auctor sed, tristique in, tempus sit amet, sem.",22,474
475,Shayla Pearman,Design Engineer,"Donec diam neque, vestibulum eget, vulputate ut, ultrices vel, augue.",24,475
476,Mallory Starkie,Senior Developer,Sed ante. Vivamus tortor.,34,476
477,Ema Ropkes,Speech Pathologist,Proin interdum mauris non ligula pellentesque ultrices. Phasellus id sapien in sapien iaculis congue.,25,477
478,Maxie Redholes,Assistant Professor,Aliquam quis turpis eget elit sodales scelerisque.,17,478
479,Wilton Probate,Statistician III,In hac habitasse platea dictumst.,29,479
480,Dave Fourmy,Community Outreach Specialist,Donec quis orci eget orci vehicula condimentum.,30,480
481,Pavla Velti,Account Executive,Maecenas tincidunt lacus at velit.,5,481
482,Konrad Josham,Sales Representative,Suspendisse potenti. In eleifend quam a odio.,14,482
483,Gale Lardge,Quality Engineer,"Morbi vel lectus in quam fringilla rhoncus. Mauris enim leo, rhoncus sed, vestibulum sit amet, cursus id, turpis.",39,483
484,Phil Humes,GIS Technical Architect,In hac habitasse platea dictumst.,13,484
485,Doralynne Hebden,Social Worker,Nulla facilisi. Cras non velit nec nisi vulputate nonummy.,22,485
486,Raymond Leeder,Staff Accountant II,Integer ac leo. Pellentesque ultrices mattis odio.,33,486
487,Sybille Laise,Automation Specialist IV,Sed sagittis.,34,487
488,Marcile Thomsson,Nuclear Power Engineer,Proin risus. Praesent lectus.,1,488
489,Barnard Kilduff,Programmer II,Curabitur convallis.,24,489
