id,Назначение,Размер,Вес,Легальность,Содержимое,Хрупкость,id_Ticket
472,Гражданское,aliquam sit amet,24,1,"Integer pede justo, lacinia eget, tincidunt eget, tempus vel, pede. Morbi porttitor lorem id ligula.",1,472
473,Гражданское,habitasse,33,1,"Vestibulum quam sapien, varius ut, blandit non, interdum in, ante.",0,473
474,Гражданское,ultrices aliquet maecenas leo,17,0,"Duis ac nibh. Fusce lacus purus, aliquet at, feugiat non, pretium quis, lectus.",1,474
475,Военное,mattis nibh ligula,40,1,Nulla mollis molestie lorem. Quisque ut erat.,0,475
476,Военное,libero nullam sit amet,44,1,"Vestibulum ante ipsum primis in faucibus orci luctus et ultrices posuere cubilia Curae; Donec pharetra, magna vestibulum aliquet ultrices, erat tortor sollicitudin mi, sit amet lobortis sapien sapien non mi. Integer ac neque.",1,476
477,Военное,in hac habitasse platea,24,0,Suspendisse potenti. Cras in purus eu magna vulputate luctus.,1,477
478,Военное,curae donec pharetra,37,0,"Cum sociis natoque penatibus et magnis dis parturient montes, nascetur ridiculus mus.",1,478
479,Гражданское,gravida sem,27,1,Nulla facilisi.,0,479
480,Гражданское,leo odio condimentum,46,0,Morbi porttitor lorem id ligula.,0,480
481,Военное,in,4,0,Praesent id massa id nisl venenatis lacinia.,1,481
482,Военное,mauris laoreet ut,49,0,Vivamus in felis eu sapien cursus vestibulum.,1,482
483,Гражданское,amet justo,24,0,"Donec odio justo, sollicitudin ut, suscipit a, feugiat et, eros.",0,483
484,Гражданское,semper,3,0,Proin interdum mauris non ligula pellentesque ultrices.,1,484
485,Военное,vestibulum quam sapien varius,38,1,Maecenas tincidunt lacus at velit.,0,485
486,Военное,nascetur ridiculus,36,1,"Nullam orci pede, venenatis non, sodales sed, tincidunt eu, felis. Fusce posuere felis sed lacus.",0,486
487,Военное,lectus,21,1,In blandit ultrices enim.,0,487
488,Гражданское,maecenas,5,0,Suspendisse accumsan tortor quis turpis. Sed ante.,0,488
489,Военное,bibendum felis sed,39,0,"Vestibulum ante ipsum primis in faucibus orci luctus et ultrices posuere cubilia Curae; Donec pharetra, magna vestibulum aliquet ultrices, erat tortor sollicitudin mi, sit amet lobortis sapien sapien non mi.",0,489
490,Военное,urna ut tellus nulla,47,0,Nullam porttitor lacus at turpis.,0,490
491,Гражданское,luctus,21,1,Morbi non lectus.,0,491
492,Гражданское,habitasse platea dictumst aliquam,24,1,Vivamus vestibulum sagittis sapien.,1,492
493,Военное,nulla mollis molestie lorem,23,1,"Integer aliquet, massa id lobortis convallis, tortor risus dapibus augue, vel accumsan tellus nisi eu orci.",0,493
494,Военное,vulputate nonummy,39,0,Donec ut dolor.,0,494
495,Гражданское,at velit vivamus vel,27,0,"Cum sociis natoque penatibus et magnis dis parturient montes, nascetur ridiculus mus. Vivamus vestibulum sagittis sapien.",1,495
496,Военное,risus auctor,44,1,"Quisque erat eros, viverra eget, congue eget, semper rutrum, nulla.",1,496
497,Военное,aliquet ultrices,50,0,Vestibulum ante ipsum primis in faucibus orci luctus et ultrices posuere cubilia Curae; Mauris viverra diam vitae quam.,0,497
498,Гражданское,mauris,4,1,Phasellus id sapien in sapien iaculis congue.,1,498
499,Военное,lectus in est,30,0,Nullam molestie nibh in lectus. Pellentesque at nulla.,0,499
500,Гражданское,sapien iaculis congue vivamus,4,1,Morbi vel lectus in quam fringilla rhoncus.,0,500
501,Военное,consectetuer,47,0,"Cum sociis natoque penatibus et magnis dis parturient montes, nascetur ridiculus mus. Etiam vel augue.",0,501
502,Гражданское,augue vestibulum,2,1,In hac habitasse platea dictumst.,1,502
503,Военное,augue quam,22,0,Curabitur gravida nisi at nibh.,0,503
504,Военное,ut blandit non interdum,2,1,Vestibulum ante ipsum primis in faucibus orci luctus et ultrices posuere cubilia Curae; Mauris viverra diam vitae quam.,0,504
505,Гражданское,ultrices aliquet maecenas,17,1,Vestibulum rutrum rutrum neque. Aenean auctor gravida sem.,0,505
506,Гражданское,tincidunt ante vel ipsum,28,0,Nunc rhoncus dui vel sem. Sed sagittis.,0,506
507,Военное,velit vivamus vel,18,0,Aliquam erat volutpat. In congue.,1,507
508,Гражданское,eget tempus,17,0,Morbi a ipsum.,1,508
509,Военное,posuere cubilia curae donec,37,0,Praesent id massa id nisl venenatis lacinia.,0,509
510,Гражданское,mauris morbi,45,1,Curabitur at ipsum ac tellus semper interdum.,0,510
511,Гражданское,in,30,0,In hac habitasse platea dictumst.,0,511
512,Военное,lectus vestibulum quam,41,1,Proin risus. Praesent lectus.,0,512
513,Военное,nisl,3,1,"Cras mi pede, malesuada in, imperdiet et, commodo vulputate, justo. In blandit ultrices enim.",0,513
514,Военное,venenatis lacinia aenean sit,50,1,Fusce consequat. Nulla nisl.,1,514
515,Военное,volutpat dui maecenas,31,1,Aliquam quis turpis eget elit sodales scelerisque. Mauris sit amet eros.,0,515
516,Военное,turpis eget,8,1,Phasellus in felis.,1,516
517,Военное,amet eleifend pede,40,1,Mauris sit amet eros. Suspendisse accumsan tortor quis turpis.,0,517
518,Гражданское,vulputate justo in,48,1,Curabitur at ipsum ac tellus semper interdum. Mauris ullamcorper purus sit amet nulla.,0,518
519,Гражданское,cubilia curae donec,12,0,"Duis bibendum, felis sed interdum venenatis, turpis enim blandit mi, in porttitor pede justo eu massa. Donec dapibus.",0,519
520,Военное,sit amet nulla,10,1,Sed accumsan felis.,1,520
521,Гражданское,est,5,0,"Lorem ipsum dolor sit amet, consectetuer adipiscing elit. Proin risus.",1,521
522,Гражданское,ipsum,32,0,Vestibulum ante ipsum primis in faucibus orci luctus et ultrices posuere cubilia Curae; Duis faucibus accumsan odio.,0,522
523,Военное,ornare,10,1,Ut tellus.,1,523
524,Гражданское,magna bibendum,29,1,"In tempor, turpis nec euismod scelerisque, quam turpis adipiscing lorem, vitae mattis nibh ligula nec sem.",1,524
525,Военное,lectus pellentesque eget nunc,21,0,"In est risus, auctor sed, tristique in, tempus sit amet, sem. Fusce consequat.",1,525
526,Военное,felis,29,0,Curabitur at ipsum ac tellus semper interdum.,1,526
527,Военное,est,14,1,Nulla tellus.,0,527
528,Гражданское,non interdum,13,0,"Aliquam sit amet diam in magna bibendum imperdiet. Nullam orci pede, venenatis non, sodales sed, tincidunt eu, felis.",0,528
529,Военное,orci luctus et ultrices,2,1,Sed accumsan felis.,1,529
530,Военное,nulla sed accumsan,3,0,Nulla tempus.,0,530
531,Военное,magnis,45,1,Integer ac neque.,1,531
532,Гражданское,amet,12,0,Vestibulum ante ipsum primis in faucibus orci luctus et ultrices posuere cubilia Curae; Mauris viverra diam vitae quam. Suspendisse potenti.,1,532
533,Военное,semper,45,1,Etiam justo.,1,533
534,Военное,congue diam id ornare,16,1,Nulla justo. Aliquam quis turpis eget elit sodales scelerisque.,0,534
535,Гражданское,viverra,19,0,Maecenas rhoncus aliquam lacus. Morbi quis tortor id nulla ultrices aliquet.,1,535
536,Военное,consequat morbi a ipsum,20,0,Suspendisse potenti. In eleifend quam a odio.,1,536
537,Военное,bibendum imperdiet nullam,38,1,Etiam faucibus cursus urna. Ut tellus.,1,537
538,Военное,bibendum felis sed interdum,32,0,Mauris ullamcorper purus sit amet nulla.,1,538
539,Военное,congue vivamus metus,33,0,"Duis bibendum, felis sed interdum venenatis, turpis enim blandit mi, in porttitor pede justo eu massa.",1,539
540,Гражданское,dis parturient montes,28,0,"Donec ut mauris eget massa tempor convallis. Nulla neque libero, convallis eget, eleifend luctus, ultricies eu, nibh.",1,540
541,Гражданское,aenean fermentum donec ut,46,1,Mauris lacinia sapien quis libero. Nullam sit amet turpis elementum ligula vehicula consequat.,1,541
542,Военное,fermentum justo,15,0,Curabitur gravida nisi at nibh.,1,542
543,Гражданское,nullam sit,5,0,Curabitur gravida nisi at nibh.,1,543
544,Военное,interdum eu tincidunt,7,1,Integer a nibh. In quis justo.,0,544
545,Военное,ut suscipit a,32,0,"Vestibulum ante ipsum primis in faucibus orci luctus et ultrices posuere cubilia Curae; Nulla dapibus dolor vel est. Donec odio justo, sollicitudin ut, suscipit a, feugiat et, eros.",1,545
546,Военное,nunc nisl,29,1,"Morbi quis tortor id nulla ultrices aliquet. Maecenas leo odio, condimentum id, luctus nec, molestie sed, justo.",1,546
547,Гражданское,dapibus,12,1,Donec quis orci eget orci vehicula condimentum. Curabitur in libero ut massa volutpat convallis.,0,547
548,Военное,ut,29,0,Nam tristique tortor eu pede.,0,548
549,Гражданское,semper rutrum nulla,47,0,Nulla ut erat id mauris vulputate elementum.,1,549
550,Военное,lectus in,6,1,"Cum sociis natoque penatibus et magnis dis parturient montes, nascetur ridiculus mus.",1,550
551,Военное,et magnis dis,37,0,Quisque porta volutpat erat.,1,551
552,Военное,in magna bibendum,28,1,Morbi non quam nec dui luctus rutrum.,0,552
553,Военное,at,27,0,Suspendisse potenti.,1,553
554,Гражданское,ullamcorper purus sit,45,1,"In est risus, auctor sed, tristique in, tempus sit amet, sem. Fusce consequat.",1,554
555,Военное,fusce lacus purus aliquet,38,1,Cras pellentesque volutpat dui.,1,555
556,Военное,mauris non ligula,20,0,"Morbi sem mauris, laoreet ut, rhoncus aliquet, pulvinar sed, nisl.",0,556
557,Военное,viverra pede ac,5,1,Morbi non quam nec dui luctus rutrum. Nulla tellus.,1,557
558,Военное,accumsan,3,0,"Donec vitae nisi. Nam ultrices, libero non mattis pulvinar, nulla pede ullamcorper augue, a suscipit nulla elit ac nulla.",1,558
559,Гражданское,lectus pellentesque,7,1,Nulla suscipit ligula in lacus. Curabitur at ipsum ac tellus semper interdum.,1,559
560,Военное,in quis justo maecenas,39,1,Duis at velit eu est congue elementum.,1,560
561,Гражданское,eget,33,0,"Fusce congue, diam id ornare imperdiet, sapien urna pretium nisl, ut volutpat sapien arcu sed augue. Aliquam erat volutpat.",1,561
562,Военное,mi pede malesuada in,9,1,"Aliquam augue quam, sollicitudin vitae, consectetuer eget, rutrum at, lorem. Integer tincidunt ante vel ipsum.",1,562
563,Военное,diam cras,50,1,Sed ante. Vivamus tortor.,0,563
564,Военное,fringilla,21,1,Nulla suscipit ligula in lacus. Curabitur at ipsum ac tellus semper interdum.,1,564
565,Гражданское,metus aenean fermentum donec,22,0,Integer a nibh.,1,565
566,Гражданское,erat eros viverra,31,1,Vivamus in felis eu sapien cursus vestibulum.,1,566
567,Гражданское,aenean,3,1,In blandit ultrices enim.,1,567
568,Военное,a libero nam,50,1,Vivamus tortor.,1,568
569,Гражданское,eros vestibulum,36,1,"Morbi ut odio. Cras mi pede, malesuada in, imperdiet et, commodo vulputate, justo.",0,569
570,Гражданское,et magnis dis parturient,30,0,Cras in purus eu magna vulputate luctus.,0,570
571,Гражданское,tempus vel pede morbi,43,0,Mauris lacinia sapien quis libero.,1,571
572,Гражданское,in faucibus orci luctus,40,0,Nullam porttitor lacus at turpis.,0,572
573,Гражданское,pede malesuada,29,0,Nulla tellus. In sagittis dui vel nisl.,0,573
574,Гражданское,turpis,7,1,"Cras mi pede, malesuada in, imperdiet et, commodo vulputate, justo. In blandit ultrices enim.",0,574
575,Гражданское,aliquam non mauris morbi,45,1,"Fusce lacus purus, aliquet at, feugiat non, pretium quis, lectus. Suspendisse potenti.",1,575
576,Военное,congue,35,0,Pellentesque at nulla. Suspendisse potenti.,0,576
577,Военное,nullam sit amet turpis,12,0,"In hac habitasse platea dictumst. Aliquam augue quam, sollicitudin vitae, consectetuer eget, rutrum at, lorem.",0,577
578,Военное,quam,39,0,"Cum sociis natoque penatibus et magnis dis parturient montes, nascetur ridiculus mus. Vivamus vestibulum sagittis sapien.",1,578
579,Гражданское,scelerisque,49,0,Nullam molestie nibh in lectus.,1,579
580,Военное,nunc nisl,23,0,Cras non velit nec nisi vulputate nonummy.,0,580
581,Гражданское,ut massa quis augue,40,0,Sed accumsan felis.,0,581
582,Гражданское,odio porttitor id,50,0,"Morbi sem mauris, laoreet ut, rhoncus aliquet, pulvinar sed, nisl.",1,582
583,Военное,neque,33,0,"Nam congue, risus semper porta volutpat, quam pede lobortis ligula, sit amet eleifend pede libero quis orci.",0,583
584,Гражданское,semper interdum mauris ullamcorper,21,1,In hac habitasse platea dictumst.,1,584
585,Гражданское,sodales sed,47,0,Ut tellus.,1,585
586,Военное,metus aenean,46,0,Nulla tellus. In sagittis dui vel nisl.,1,586
587,Военное,sapien placerat,22,1,"Quisque porta volutpat erat. Quisque erat eros, viverra eget, congue eget, semper rutrum, nulla.",1,587
588,Военное,non mi,25,0,Nunc purus. Phasellus in felis.,1,588
589,Военное,eget tempus vel pede,13,1,Quisque id justo sit amet sapien dignissim vestibulum. Vestibulum ante ipsum primis in faucibus orci luctus et ultrices posuere cubilia Curae; Nulla dapibus dolor vel est.,1,589
590,Гражданское,nulla pede ullamcorper augue,13,1,"Maecenas leo odio, condimentum id, luctus nec, molestie sed, justo.",1,590
591,Военное,ante ipsum,31,0,Etiam pretium iaculis justo. In hac habitasse platea dictumst.,0,591
592,Гражданское,sit,41,1,Vestibulum ante ipsum primis in faucibus orci luctus et ultrices posuere cubilia Curae; Nulla dapibus dolor vel est.,0,592
593,Гражданское,proin,45,1,"Donec vitae nisi. Nam ultrices, libero non mattis pulvinar, nulla pede ullamcorper augue, a suscipit nulla elit ac nulla.",1,593
594,Гражданское,sed,42,0,Aliquam sit amet diam in magna bibendum imperdiet.,1,594
595,Гражданское,ac,34,1,Nulla nisl.,1,595
596,Военное,ut,41,0,"Fusce congue, diam id ornare imperdiet, sapien urna pretium nisl, ut volutpat sapien arcu sed augue. Aliquam erat volutpat.",1,596
597,Военное,accumsan felis,1,0,Praesent blandit lacinia erat.,0,597
598,Гражданское,at,8,1,Vivamus tortor.,0,598
599,Военное,quis orci,3,1,"Cum sociis natoque penatibus et magnis dis parturient montes, nascetur ridiculus mus.",1,599
600,Гражданское,amet eros suspendisse accumsan,29,0,"Vestibulum ac est lacinia nisi venenatis tristique. Fusce congue, diam id ornare imperdiet, sapien urna pretium nisl, ut volutpat sapien arcu sed augue.",0,600
601,Гражданское,urna pretium,15,1,"Maecenas leo odio, condimentum id, luctus nec, molestie sed, justo. Pellentesque viverra pede ac diam.",0,601
602,Военное,vivamus vestibulum sagittis sapien,19,0,"Cum sociis natoque penatibus et magnis dis parturient montes, nascetur ridiculus mus.",1,602
603,Военное,fusce congue,2,1,"Proin leo odio, porttitor id, consequat in, consequat ut, nulla.",1,603
604,Военное,vivamus,45,0,Nunc purus.,0,604
605,Гражданское,rutrum neque aenean,15,1,"Nam nulla. Integer pede justo, lacinia eget, tincidunt eget, tempus vel, pede.",1,605
606,Военное,eu,37,1,"In blandit ultrices enim. Lorem ipsum dolor sit amet, consectetuer adipiscing elit.",0,606
607,Гражданское,dapibus nulla suscipit,28,0,Vestibulum ante ipsum primis in faucibus orci luctus et ultrices posuere cubilia Curae; Mauris viverra diam vitae quam. Suspendisse potenti.,0,607
608,Гражданское,enim,48,0,Nulla facilisi. Cras non velit nec nisi vulputate nonummy.,1,608
609,Военное,eu massa donec,4,1,Phasellus id sapien in sapien iaculis congue.,0,609
610,Военное,velit donec diam neque,5,1,"Nam ultrices, libero non mattis pulvinar, nulla pede ullamcorper augue, a suscipit nulla elit ac nulla.",1,610
611,Военное,congue eget semper,33,1,In congue.,0,611
612,Гражданское,fusce,9,0,Curabitur gravida nisi at nibh.,0,612
613,Военное,ut volutpat sapien arcu,9,1,Nulla justo.,0,613
614,Гражданское,quis,43,0,Etiam vel augue. Vestibulum rutrum rutrum neque.,1,614
615,Гражданское,porta volutpat quam pede,3,1,"Maecenas tristique, est et tempus semper, est quam pharetra magna, ac consequat metus sapien ut nunc. Vestibulum ante ipsum primis in faucibus orci luctus et ultrices posuere cubilia Curae; Mauris viverra diam vitae quam.",0,615
616,Гражданское,integer ac leo,28,1,Aliquam erat volutpat.,0,616
617,Военное,bibendum morbi non quam,31,1,"Quisque arcu libero, rutrum ac, lobortis vel, dapibus at, diam. Nam tristique tortor eu pede.",1,617
618,Гражданское,lobortis vel,34,0,"Morbi sem mauris, laoreet ut, rhoncus aliquet, pulvinar sed, nisl. Nunc rhoncus dui vel sem.",0,618
619,Гражданское,lorem integer tincidunt ante,12,0,Quisque id justo sit amet sapien dignissim vestibulum.,1,619
620,Гражданское,sapien,12,0,"Morbi ut odio. Cras mi pede, malesuada in, imperdiet et, commodo vulputate, justo.",0,620
621,Гражданское,risus dapibus augue,31,1,"Donec odio justo, sollicitudin ut, suscipit a, feugiat et, eros.",1,621
622,Гражданское,a ipsum integer a,9,0,Aenean auctor gravida sem.,0,622
623,Военное,in quis justo,10,0,"Cras in purus eu magna vulputate luctus. Cum sociis natoque penatibus et magnis dis parturient montes, nascetur ridiculus mus.",0,623
624,Гражданское,ac,35,1,Etiam faucibus cursus urna. Ut tellus.,0,624
625,Военное,maecenas,45,0,In hac habitasse platea dictumst.,1,625
626,Гражданское,in magna,40,1,Suspendisse potenti. Cras in purus eu magna vulputate luctus.,0,626
627,Военное,non,21,1,Duis bibendum.,1,627
628,Военное,nam dui,39,0,Nulla nisl. Nunc nisl.,0,628
629,Гражданское,sed accumsan felis,46,1,Nullam molestie nibh in lectus.,1,629
630,Гражданское,ac consequat metus sapien,27,1,Praesent blandit lacinia erat.,0,630
631,Гражданское,nunc rhoncus,43,1,Curabitur in libero ut massa volutpat convallis.,0,631
632,Военное,montes nascetur,19,0,"Cras mi pede, malesuada in, imperdiet et, commodo vulputate, justo.",1,632
633,Гражданское,nulla suspendisse potenti cras,18,0,"Nam ultrices, libero non mattis pulvinar, nulla pede ullamcorper augue, a suscipit nulla elit ac nulla. Sed vel enim sit amet nunc viverra dapibus.",1,633
634,Гражданское,vulputate elementum nullam,38,1,Duis aliquam convallis nunc. Proin at turpis a pede posuere nonummy.,1,634
635,Военное,vel ipsum praesent,7,0,Fusce consequat.,1,635
636,Военное,orci mauris lacinia,25,1,Cras non velit nec nisi vulputate nonummy.,1,636
637,Гражданское,nisi venenatis,49,1,"Proin leo odio, porttitor id, consequat in, consequat ut, nulla.",0,637
638,Военное,morbi,4,0,"Integer aliquet, massa id lobortis convallis, tortor risus dapibus augue, vel accumsan tellus nisi eu orci.",1,638
639,Военное,eget,50,1,In blandit ultrices enim.,1,639
640,Гражданское,neque sapien,36,1,"Aliquam sit amet diam in magna bibendum imperdiet. Nullam orci pede, venenatis non, sodales sed, tincidunt eu, felis.",1,640
641,Гражданское,et,29,0,Praesent blandit. Nam nulla.,1,641
642,Гражданское,aliquet,50,0,Integer ac neque. Duis bibendum.,0,642
643,Гражданское,justo,36,1,Ut at dolor quis odio consequat varius. Integer ac leo.,1,643
644,Военное,cubilia curae duis,39,1,Sed ante. Vivamus tortor.,0,644
645,Военное,natoque penatibus,38,1,"Nam ultrices, libero non mattis pulvinar, nulla pede ullamcorper augue, a suscipit nulla elit ac nulla.",1,645
646,Военное,quam a odio in,27,0,Pellentesque eget nunc. Donec quis orci eget orci vehicula condimentum.,0,646
647,Военное,etiam pretium,27,1,Donec ut mauris eget massa tempor convallis.,0,647
648,Военное,in imperdiet,12,1,Nullam varius.,0,648
649,Военное,suspendisse potenti,3,0,Integer ac neque. Duis bibendum.,1,649
650,Военное,sit amet justo,27,0,In congue.,1,650
651,Военное,mi sit amet lobortis,9,1,Nunc purus.,1,651
652,Военное,ultrices,29,0,Duis bibendum. Morbi non quam nec dui luctus rutrum.,0,652
653,Гражданское,odio,48,0,Donec vitae nisi.,1,653
654,Гражданское,posuere cubilia curae,29,1,"Aliquam augue quam, sollicitudin vitae, consectetuer eget, rutrum at, lorem. Integer tincidunt ante vel ipsum.",0,654
655,Военное,imperdiet,36,0,Vivamus in felis eu sapien cursus vestibulum. Proin eu mi.,1,655
656,Военное,morbi non quam nec,46,1,Nulla nisl. Nunc nisl.,0,656
657,Гражданское,arcu adipiscing molestie,27,1,"Vestibulum ante ipsum primis in faucibus orci luctus et ultrices posuere cubilia Curae; Donec pharetra, magna vestibulum aliquet ultrices, erat tortor sollicitudin mi, sit amet lobortis sapien sapien non mi. Integer ac neque.",1,657
658,Военное,in,23,0,Vivamus in felis eu sapien cursus vestibulum. Proin eu mi.,1,658
659,Гражданское,molestie lorem,28,0,Mauris lacinia sapien quis libero. Nullam sit amet turpis elementum ligula vehicula consequat.,0,659
660,Военное,elementum,35,0,Donec dapibus.,0,660
661,Гражданское,duis mattis egestas,48,0,Vestibulum sed magna at nunc commodo placerat. Praesent blandit.,1,661
662,Военное,velit donec diam neque,30,0,Nulla mollis molestie lorem. Quisque ut erat.,0,662
663,Гражданское,dapibus,46,1,Proin interdum mauris non ligula pellentesque ultrices. Phasellus id sapien in sapien iaculis congue.,1,663
664,Гражданское,suscipit a,15,1,Vestibulum sed magna at nunc commodo placerat.,0,664
665,Военное,nulla quisque arcu,13,1,Nulla tellus. In sagittis dui vel nisl.,0,665
666,Гражданское,donec ut mauris eget,40,0,"Donec vitae nisi. Nam ultrices, libero non mattis pulvinar, nulla pede ullamcorper augue, a suscipit nulla elit ac nulla.",1,666
667,Гражданское,amet diam,40,1,In hac habitasse platea dictumst. Maecenas ut massa quis augue luctus tincidunt.,1,667
668,Гражданское,velit donec,28,0,"Vestibulum ante ipsum primis in faucibus orci luctus et ultrices posuere cubilia Curae; Nulla dapibus dolor vel est. Donec odio justo, sollicitudin ut, suscipit a, feugiat et, eros.",0,668
669,Военное,at dolor,29,1,"Morbi vestibulum, velit id pretium iaculis, diam erat fermentum justo, nec condimentum neque sapien placerat ante. Nulla justo.",0,669
670,Гражданское,sapien,7,1,Phasellus in felis. Donec semper sapien a libero.,0,670
671,Военное,nunc commodo placerat,42,1,Nulla suscipit ligula in lacus.,1,671
672,Военное,nunc purus phasellus,14,0,Maecenas rhoncus aliquam lacus.,0,672
673,Гражданское,arcu adipiscing,40,1,Donec semper sapien a libero.,1,673
674,Гражданское,pede venenatis,23,1,Morbi ut odio.,1,674
675,Военное,massa id nisl venenatis,22,0,"Nam congue, risus semper porta volutpat, quam pede lobortis ligula, sit amet eleifend pede libero quis orci. Nullam molestie nibh in lectus.",0,675
676,Гражданское,sit amet erat,40,1,Vestibulum ac est lacinia nisi venenatis tristique.,0,676
677,Гражданское,leo odio condimentum,21,1,Proin interdum mauris non ligula pellentesque ultrices.,1,677
678,Военное,quis,11,0,Nulla mollis molestie lorem.,0,678
679,Гражданское,eros viverra eget,48,1,Vestibulum ante ipsum primis in faucibus orci luctus et ultrices posuere cubilia Curae; Duis faucibus accumsan odio.,1,679
680,Военное,nisl venenatis,34,1,Duis mattis egestas metus.,1,680
681,Военное,sapien non mi integer,43,1,Integer tincidunt ante vel ipsum.,1,681
682,Гражданское,diam neque vestibulum eget,13,1,"Aliquam sit amet diam in magna bibendum imperdiet. Nullam orci pede, venenatis non, sodales sed, tincidunt eu, felis.",0,682
683,Военное,vel augue vestibulum ante,10,0,"Quisque porta volutpat erat. Quisque erat eros, viverra eget, congue eget, semper rutrum, nulla.",1,683
684,Военное,purus phasellus in felis,15,1,Etiam faucibus cursus urna. Ut tellus.,0,684
685,Военное,primis in faucibus orci,26,1,Sed accumsan felis. Ut at dolor quis odio consequat varius.,0,685
686,Военное,lacus morbi sem,3,0,Maecenas pulvinar lobortis est. Phasellus sit amet erat.,0,686
687,Военное,nulla quisque arcu libero,37,0,"In blandit ultrices enim. Lorem ipsum dolor sit amet, consectetuer adipiscing elit.",1,687
688,Гражданское,nunc commodo placerat,47,0,Nunc purus.,0,688
689,Гражданское,ut dolor morbi,29,0,In eleifend quam a odio.,1,689
690,Гражданское,mauris sit,37,1,"Nam ultrices, libero non mattis pulvinar, nulla pede ullamcorper augue, a suscipit nulla elit ac nulla.",0,690
691,Военное,ante ipsum primis,44,1,Duis bibendum.,0,691
692,Военное,eros vestibulum,7,1,Morbi ut odio.,0,692
693,Гражданское,ipsum dolor sit amet,39,0,Phasellus sit amet erat. Nulla tempus.,0,693
694,Гражданское,eu,21,1,"Aliquam augue quam, sollicitudin vitae, consectetuer eget, rutrum at, lorem.",0,694
695,Гражданское,auctor sed,14,1,"Quisque arcu libero, rutrum ac, lobortis vel, dapibus at, diam.",1,695
696,Гражданское,lectus,16,0,Vestibulum sed magna at nunc commodo placerat. Praesent blandit.,1,696
697,Военное,tristique tortor eu,4,0,Morbi non quam nec dui luctus rutrum. Nulla tellus.,0,697
698,Гражданское,duis faucibus,44,1,"Vivamus metus arcu, adipiscing molestie, hendrerit at, vulputate vitae, nisl. Aenean lectus.",1,698
699,Военное,odio,37,1,Phasellus sit amet erat.,1,699
