id,Назначение,Размер,Вес,Легальность,Содержимое,Хрупкость,id_Ticket
700,Гражданское,nibh quisque id justo,47,1,Etiam justo. Etiam pretium iaculis justo.,1,700
701,Гражданское,tempor convallis nulla neque,27,0,Sed vel enim sit amet nunc viverra dapibus. Nulla suscipit ligula in lacus.,1,701
702,Военное,dapibus duis at,1,0,Nam nulla.,1,702
703,Гражданское,platea dictumst,39,1,Sed ante.,0,703
704,Военное,dui,25,0,Donec vitae nisi.,1,704
705,Гражданское,enim sit,42,0,"Cum sociis natoque penatibus et magnis dis parturient montes, nascetur ridiculus mus. Vivamus vestibulum sagittis sapien.",1,705
706,Военное,etiam,34,0,Suspendisse potenti. Cras in purus eu magna vulputate luctus.,0,706
707,Гражданское,cum sociis natoque,28,1,"Nulla neque libero, convallis eget, eleifend luctus, ultricies eu, nibh. Quisque id justo sit amet sapien dignissim vestibulum.",1,707
708,Гражданское,rutrum,3,1,"Donec vitae nisi. Nam ultrices, libero non mattis pulvinar, nulla pede ullamcorper augue, a suscipit nulla elit ac nulla.",0,708
709,Военное,a nibh in,47,0,Nulla tempus.,1,709
710,Гражданское,massa id lobortis convallis,48,0,"Cras pellentesque volutpat dui. Maecenas tristique, est et tempus semper, est quam pharetra magna, ac consequat metus sapien ut nunc.",1,710
711,Гражданское,in,3,1,"Lorem ipsum dolor sit amet, consectetuer adipiscing elit. Proin risus.",1,711
712,Гражданское,id massa id nisl,11,0,Morbi porttitor lorem id ligula. Suspendisse ornare consequat lectus.,0,712
713,Гражданское,metus sapien ut nunc,30,0,Duis consequat dui nec nisi volutpat eleifend.,1,713
714,Военное,erat,34,1,"Quisque erat eros, viverra eget, congue eget, semper rutrum, nulla.",0,714
715,Гражданское,augue a,23,0,Duis mattis egestas metus. Aenean fermentum.,1,715
716,Гражданское,sed tincidunt eu felis,27,0,Maecenas tincidunt lacus at velit.,1,716
717,Военное,pede ac diam cras,41,0,Duis aliquam convallis nunc. Proin at turpis a pede posuere nonummy.,0,717
718,Военное,curabitur gravida,7,1,"Fusce lacus purus, aliquet at, feugiat non, pretium quis, lectus. Suspendisse potenti.",0,718
719,Военное,sit amet,11,1,Vivamus vestibulum sagittis sapien.,1,719
720,Гражданское,hendrerit at vulputate,10,1,"Morbi odio odio, elementum eu, interdum eu, tincidunt in, leo.",0,720
721,Гражданское,duis consequat,43,1,"Fusce posuere felis sed lacus. Morbi sem mauris, laoreet ut, rhoncus aliquet, pulvinar sed, nisl.",1,721
722,Гражданское,non velit nec,29,0,"Lorem ipsum dolor sit amet, consectetuer adipiscing elit.",1,722
723,Гражданское,dui vel sem,16,0,Vivamus vel nulla eget eros elementum pellentesque.,1,723
724,Гражданское,sapien urna pretium,32,0,Nulla justo. Aliquam quis turpis eget elit sodales scelerisque.,0,724
725,Гражданское,dapibus augue vel,48,1,"In hac habitasse platea dictumst. Aliquam augue quam, sollicitudin vitae, consectetuer eget, rutrum at, lorem.",1,725
726,Военное,ipsum ac tellus,43,1,Aenean fermentum. Donec ut mauris eget massa tempor convallis.,0,726
727,Военное,posuere,10,0,Nulla tellus.,1,727
728,Военное,nibh ligula nec,49,1,Curabitur gravida nisi at nibh.,1,728
729,Гражданское,vestibulum sit,34,0,Pellentesque eget nunc. Donec quis orci eget orci vehicula condimentum.,0,729
730,Гражданское,velit id,23,0,Morbi non lectus. Aliquam sit amet diam in magna bibendum imperdiet.,1,730
731,Военное,a,46,0,Aenean sit amet justo. Morbi ut odio.,1,731
732,Гражданское,id justo,38,1,"Praesent lectus. Vestibulum quam sapien, varius ut, blandit non, interdum in, ante.",0,732
733,Гражданское,curae duis faucibus,26,0,Aenean sit amet justo. Morbi ut odio.,0,733
734,Гражданское,luctus tincidunt nulla mollis,23,1,"In hac habitasse platea dictumst. Morbi vestibulum, velit id pretium iaculis, diam erat fermentum justo, nec condimentum neque sapien placerat ante.",0,734
735,Военное,porttitor lorem id,13,0,"Vestibulum ac est lacinia nisi venenatis tristique. Fusce congue, diam id ornare imperdiet, sapien urna pretium nisl, ut volutpat sapien arcu sed augue.",1,735
736,Гражданское,nibh ligula,37,0,"Nulla neque libero, convallis eget, eleifend luctus, ultricies eu, nibh.",1,736
737,Военное,in hac habitasse,5,1,Pellentesque eget nunc.,0,737
738,Военное,nulla ultrices aliquet maecenas,34,0,Pellentesque viverra pede ac diam.,1,738
739,Гражданское,dictumst morbi vestibulum,5,1,"Vivamus metus arcu, adipiscing molestie, hendrerit at, vulputate vitae, nisl.",1,739
740,Гражданское,a nibh in quis,50,1,"Nulla ac enim. In tempor, turpis nec euismod scelerisque, quam turpis adipiscing lorem, vitae mattis nibh ligula nec sem.",1,740
741,Гражданское,blandit non,18,0,Cras non velit nec nisi vulputate nonummy. Maecenas tincidunt lacus at velit.,1,741
742,Гражданское,habitasse platea,3,1,Mauris sit amet eros.,0,742
743,Военное,varius ut blandit,2,1,Praesent blandit.,0,743
744,Гражданское,nam ultrices libero non,5,0,"Nam dui. Proin leo odio, porttitor id, consequat in, consequat ut, nulla.",1,744
745,Гражданское,sit amet diam,25,0,"Vivamus metus arcu, adipiscing molestie, hendrerit at, vulputate vitae, nisl. Aenean lectus.",0,745
746,Военное,purus phasellus in felis,47,0,Vivamus in felis eu sapien cursus vestibulum.,1,746
747,Военное,phasellus,28,0,"In est risus, auctor sed, tristique in, tempus sit amet, sem.",0,747
748,Военное,diam neque vestibulum eget,36,0,Vestibulum ac est lacinia nisi venenatis tristique.,0,748
749,Военное,enim leo rhoncus,23,1,Cras non velit nec nisi vulputate nonummy. Maecenas tincidunt lacus at velit.,1,749
750,Гражданское,molestie,19,1,Maecenas tincidunt lacus at velit. Vivamus vel nulla eget eros elementum pellentesque.,0,750
751,Гражданское,eleifend quam a,19,0,Donec quis orci eget orci vehicula condimentum. Curabitur in libero ut massa volutpat convallis.,0,751
752,Военное,leo rhoncus,25,0,Proin eu mi.,0,752
753,Военное,phasellus in,49,0,Proin interdum mauris non ligula pellentesque ultrices. Phasellus id sapien in sapien iaculis congue.,1,753
754,Военное,lacinia,30,1,"Aliquam sit amet diam in magna bibendum imperdiet. Nullam orci pede, venenatis non, sodales sed, tincidunt eu, felis.",0,754
755,Военное,nunc,47,0,Quisque id justo sit amet sapien dignissim vestibulum.,1,755
756,Гражданское,id ornare imperdiet,39,1,Quisque ut erat.,0,756
757,Военное,praesent blandit nam,33,0,Ut tellus. Nulla ut erat id mauris vulputate elementum.,0,757
758,Гражданское,penatibus,15,1,"Lorem ipsum dolor sit amet, consectetuer adipiscing elit. Proin interdum mauris non ligula pellentesque ultrices.",1,758
759,Военное,pellentesque,8,1,"Donec ut mauris eget massa tempor convallis. Nulla neque libero, convallis eget, eleifend luctus, ultricies eu, nibh.",1,759
760,Гражданское,leo pellentesque ultrices,15,0,"Maecenas leo odio, condimentum id, luctus nec, molestie sed, justo. Pellentesque viverra pede ac diam.",0,760
761,Военное,arcu adipiscing molestie,5,0,"Aliquam augue quam, sollicitudin vitae, consectetuer eget, rutrum at, lorem. Integer tincidunt ante vel ipsum.",0,761
762,Военное,ipsum aliquam non mauris,47,1,In congue. Etiam justo.,1,762
763,Военное,et magnis dis,9,1,"Donec diam neque, vestibulum eget, vulputate ut, ultrices vel, augue. Vestibulum ante ipsum primis in faucibus orci luctus et ultrices posuere cubilia Curae; Donec pharetra, magna vestibulum aliquet ultrices, erat tortor sollicitudin mi, sit amet lobortis sapien sapien non mi.",0,763
764,Гражданское,morbi non quam,21,1,Nullam varius. Nulla facilisi.,0,764
765,Гражданское,quis,5,1,Maecenas rhoncus aliquam lacus.,0,765
766,Гражданское,vulputate luctus,33,0,In hac habitasse platea dictumst. Maecenas ut massa quis augue luctus tincidunt.,0,766
767,Гражданское,rhoncus mauris enim leo,50,1,In hac habitasse platea dictumst.,1,767
768,Военное,est risus,32,1,Suspendisse potenti. In eleifend quam a odio.,0,768
769,Гражданское,amet turpis,19,0,Pellentesque ultrices mattis odio.,0,769
770,Военное,enim,4,0,"In tempor, turpis nec euismod scelerisque, quam turpis adipiscing lorem, vitae mattis nibh ligula nec sem.",1,770
771,Гражданское,in eleifend quam a,11,0,"Quisque erat eros, viverra eget, congue eget, semper rutrum, nulla.",1,771
772,Военное,nulla justo aliquam quis,1,0,Proin risus.,0,772
773,Гражданское,maecenas,35,1,Nunc purus.,0,773
774,Гражданское,sit amet consectetuer,17,1,Maecenas ut massa quis augue luctus tincidunt.,0,774
775,Военное,ut,33,0,Vestibulum ac est lacinia nisi venenatis tristique.,0,775
776,Гражданское,ac enim,17,0,"Nullam orci pede, venenatis non, sodales sed, tincidunt eu, felis. Fusce posuere felis sed lacus.",1,776
777,Гражданское,magnis dis parturient montes,7,0,Curabitur gravida nisi at nibh. In hac habitasse platea dictumst.,1,777
778,Военное,elit,12,1,Proin risus. Praesent lectus.,0,778
779,Гражданское,odio justo sollicitudin ut,27,0,"Donec ut mauris eget massa tempor convallis. Nulla neque libero, convallis eget, eleifend luctus, ultricies eu, nibh.",1,779
780,Гражданское,nisl duis,25,0,Nam dui.,1,780
781,Военное,amet eros suspendisse accumsan,27,1,"Cras mi pede, malesuada in, imperdiet et, commodo vulputate, justo. In blandit ultrices enim.",1,781
782,Военное,ante ipsum primis,25,0,In hac habitasse platea dictumst.,1,782
783,Военное,in tempus sit amet,23,1,Nullam sit amet turpis elementum ligula vehicula consequat.,1,783
784,Военное,dapibus,4,1,Duis at velit eu est congue elementum.,1,784
785,Военное,in lacus,36,1,"Suspendisse ornare consequat lectus. In est risus, auctor sed, tristique in, tempus sit amet, sem.",0,785
786,Военное,in hac habitasse,19,0,Phasellus id sapien in sapien iaculis congue.,1,786
787,Военное,pellentesque,18,1,In hac habitasse platea dictumst.,1,787
788,Гражданское,nam dui proin,6,0,Curabitur convallis.,1,788
789,Военное,platea dictumst maecenas ut,35,0,Vestibulum ante ipsum primis in faucibus orci luctus et ultrices posuere cubilia Curae; Mauris viverra diam vitae quam. Suspendisse potenti.,0,789
790,Военное,non quam nec dui,44,0,"Proin leo odio, porttitor id, consequat in, consequat ut, nulla. Sed accumsan felis.",1,790
791,Гражданское,erat,10,1,Curabitur gravida nisi at nibh. In hac habitasse platea dictumst.,1,791
792,Гражданское,congue diam,1,0,Vestibulum ante ipsum primis in faucibus orci luctus et ultrices posuere cubilia Curae; Nulla dapibus dolor vel est.,0,792
793,Военное,eu interdum eu tincidunt,28,0,"Donec ut mauris eget massa tempor convallis. Nulla neque libero, convallis eget, eleifend luctus, ultricies eu, nibh.",0,793
794,Гражданское,quam pharetra magna ac,21,0,Aenean fermentum. Donec ut mauris eget massa tempor convallis.,0,794
795,Военное,faucibus,46,1,Vestibulum rutrum rutrum neque.,0,795
796,Военное,nunc donec quis orci,37,0,Curabitur convallis.,0,796
797,Военное,ligula vehicula consequat,39,0,"In hac habitasse platea dictumst. Aliquam augue quam, sollicitudin vitae, consectetuer eget, rutrum at, lorem.",1,797
798,Военное,molestie,34,0,In quis justo. Maecenas rhoncus aliquam lacus.,0,798
799,Военное,nisl venenatis lacinia,13,1,Donec ut dolor.,0,799
800,Гражданское,curae nulla dapibus,44,0,Vivamus vestibulum sagittis sapien.,0,800
801,Гражданское,etiam pretium iaculis,17,1,"Morbi sem mauris, laoreet ut, rhoncus aliquet, pulvinar sed, nisl. Nunc rhoncus dui vel sem.",0,801
802,Военное,sed vel enim,10,1,Aliquam quis turpis eget elit sodales scelerisque. Mauris sit amet eros.,1,802
803,Военное,nulla facilisi cras,49,1,Mauris sit amet eros.,1,803
804,Военное,integer ac leo pellentesque,24,0,Sed sagittis.,1,804
805,Гражданское,hac habitasse platea dictumst,34,0,"Nam ultrices, libero non mattis pulvinar, nulla pede ullamcorper augue, a suscipit nulla elit ac nulla.",0,805
806,Гражданское,a,9,1,Nunc rhoncus dui vel sem. Sed sagittis.,1,806
807,Военное,nulla sed accumsan felis,31,1,In eleifend quam a odio. In hac habitasse platea dictumst.,0,807
808,Гражданское,imperdiet sapien urna,16,1,"Duis bibendum, felis sed interdum venenatis, turpis enim blandit mi, in porttitor pede justo eu massa.",1,808
809,Военное,justo in blandit,1,1,Morbi non quam nec dui luctus rutrum. Nulla tellus.,0,809
810,Военное,integer non velit,37,1,"Morbi odio odio, elementum eu, interdum eu, tincidunt in, leo.",1,810
811,Военное,ac leo pellentesque,42,1,Curabitur gravida nisi at nibh.,1,811
812,Военное,nulla tellus in sagittis,3,1,"Quisque porta volutpat erat. Quisque erat eros, viverra eget, congue eget, semper rutrum, nulla.",0,812
813,Военное,blandit,16,0,Aenean sit amet justo.,0,813
814,Военное,vitae nisl,27,0,Morbi porttitor lorem id ligula.,1,814
815,Гражданское,eu,16,0,Pellentesque ultrices mattis odio. Donec vitae nisi.,1,815
816,Гражданское,sed augue aliquam erat,27,0,Pellentesque viverra pede ac diam.,1,816
817,Гражданское,nulla justo aliquam,8,1,Duis aliquam convallis nunc.,1,817
818,Гражданское,turpis sed ante,9,1,"Fusce lacus purus, aliquet at, feugiat non, pretium quis, lectus.",0,818
819,Военное,ultrices enim,40,1,"Fusce posuere felis sed lacus. Morbi sem mauris, laoreet ut, rhoncus aliquet, pulvinar sed, nisl.",1,819
820,Военное,morbi non,5,0,Aenean auctor gravida sem. Praesent id massa id nisl venenatis lacinia.,1,820
821,Военное,quis lectus suspendisse,33,1,"Suspendisse ornare consequat lectus. In est risus, auctor sed, tristique in, tempus sit amet, sem.",1,821
822,Военное,posuere,34,0,Ut at dolor quis odio consequat varius.,1,822
823,Военное,vulputate elementum nullam varius,13,0,Fusce posuere felis sed lacus.,0,823
824,Гражданское,ipsum primis in faucibus,49,1,"Vestibulum ante ipsum primis in faucibus orci luctus et ultrices posuere cubilia Curae; Donec pharetra, magna vestibulum aliquet ultrices, erat tortor sollicitudin mi, sit amet lobortis sapien sapien non mi. Integer ac neque.",1,824
825,Военное,praesent blandit,26,0,Integer ac neque. Duis bibendum.,0,825
826,Гражданское,ac nibh fusce,8,0,Integer tincidunt ante vel ipsum.,1,826
827,Военное,felis sed,25,1,Maecenas ut massa quis augue luctus tincidunt. Nulla mollis molestie lorem.,0,827
828,Военное,rutrum nulla nunc,36,0,Nunc nisl.,0,828
829,Гражданское,lacus,37,0,Cras non velit nec nisi vulputate nonummy. Maecenas tincidunt lacus at velit.,1,829
830,Военное,sit amet,3,0,Proin risus. Praesent lectus.,1,830
831,Военное,faucibus orci luctus et,11,1,In hac habitasse platea dictumst. Etiam faucibus cursus urna.,0,831
832,Гражданское,vulputate luctus,29,1,"Mauris enim leo, rhoncus sed, vestibulum sit amet, cursus id, turpis.",1,832
833,Гражданское,posuere cubilia,16,0,Phasellus id sapien in sapien iaculis congue.,0,833
834,Гражданское,duis mattis egestas metus,50,0,Nulla nisl. Nunc nisl.,1,834
835,Военное,in sagittis dui vel,27,0,Vivamus tortor. Duis mattis egestas metus.,0,835
836,Гражданское,nisl duis,2,1,Vestibulum rutrum rutrum neque.,1,836
837,Военное,ut suscipit,21,0,"Cum sociis natoque penatibus et magnis dis parturient montes, nascetur ridiculus mus. Etiam vel augue.",0,837
838,Гражданское,varius integer,28,0,Nunc rhoncus dui vel sem. Sed sagittis.,1,838
839,Гражданское,elementum nullam varius nulla,20,0,"Integer non velit. Donec diam neque, vestibulum eget, vulputate ut, ultrices vel, augue.",0,839
840,Военное,volutpat erat quisque,5,1,"Fusce lacus purus, aliquet at, feugiat non, pretium quis, lectus. Suspendisse potenti.",1,840
841,Военное,pulvinar lobortis est,46,1,Morbi a ipsum.,1,841
842,Военное,ridiculus mus,27,1,"Morbi sem mauris, laoreet ut, rhoncus aliquet, pulvinar sed, nisl.",1,842
843,Гражданское,nulla,36,0,Mauris ullamcorper purus sit amet nulla.,0,843
844,Военное,mi sit amet lobortis,20,1,"Nulla ac enim. In tempor, turpis nec euismod scelerisque, quam turpis adipiscing lorem, vitae mattis nibh ligula nec sem.",1,844
845,Военное,at nulla,44,0,In sagittis dui vel nisl. Duis ac nibh.,0,845
846,Военное,in magna bibendum imperdiet,13,0,In hac habitasse platea dictumst.,1,846
847,Военное,leo,48,0,Suspendisse potenti. Nullam porttitor lacus at turpis.,0,847
848,Военное,maecenas tincidunt lacus,14,0,Duis aliquam convallis nunc.,0,848
849,Военное,tempor turpis nec euismod,1,0,Nullam varius.,1,849
850,Гражданское,a,49,0,Pellentesque viverra pede ac diam. Cras pellentesque volutpat dui.,0,850
851,Гражданское,tristique est et tempus,13,0,"Mauris ullamcorper purus sit amet nulla. Quisque arcu libero, rutrum ac, lobortis vel, dapibus at, diam.",0,851
852,Военное,faucibus accumsan odio,40,1,"Nullam orci pede, venenatis non, sodales sed, tincidunt eu, felis.",0,852
853,Гражданское,sed ante,20,0,Maecenas pulvinar lobortis est. Phasellus sit amet erat.,1,853
854,Военное,sed nisl,29,1,"Vestibulum ante ipsum primis in faucibus orci luctus et ultrices posuere cubilia Curae; Donec pharetra, magna vestibulum aliquet ultrices, erat tortor sollicitudin mi, sit amet lobortis sapien sapien non mi.",1,854
855,Военное,interdum,8,1,"Lorem ipsum dolor sit amet, consectetuer adipiscing elit.",1,855
856,Военное,risus,18,1,Aenean auctor gravida sem.,1,856
857,Военное,at nulla,11,1,"Lorem ipsum dolor sit amet, consectetuer adipiscing elit. Proin risus.",1,857
858,Гражданское,mauris,3,0,"Nam congue, risus semper porta volutpat, quam pede lobortis ligula, sit amet eleifend pede libero quis orci.",0,858
859,Гражданское,ut nunc vestibulum,36,0,Nullam porttitor lacus at turpis. Donec posuere metus vitae ipsum.,0,859
860,Военное,vulputate,42,0,"Cum sociis natoque penatibus et magnis dis parturient montes, nascetur ridiculus mus. Etiam vel augue.",1,860
861,Военное,id turpis,4,0,"Donec ut mauris eget massa tempor convallis. Nulla neque libero, convallis eget, eleifend luctus, ultricies eu, nibh.",1,861
862,Гражданское,nibh in,8,0,Suspendisse potenti.,0,862
863,Военное,cum,14,0,Maecenas tincidunt lacus at velit. Vivamus vel nulla eget eros elementum pellentesque.,1,863
864,Гражданское,accumsan odio,20,1,"Aliquam augue quam, sollicitudin vitae, consectetuer eget, rutrum at, lorem. Integer tincidunt ante vel ipsum.",1,864
865,Военное,lorem,18,0,Nulla mollis molestie lorem.,0,865
866,Военное,sed,7,1,Vestibulum sed magna at nunc commodo placerat. Praesent blandit.,0,866
867,Военное,urna pretium nisl ut,10,0,Donec semper sapien a libero. Nam dui.,0,867
868,Гражданское,porttitor pede justo eu,48,0,Cras non velit nec nisi vulputate nonummy. Maecenas tincidunt lacus at velit.,0,868
869,Гражданское,non ligula pellentesque ultrices,8,1,"Nam ultrices, libero non mattis pulvinar, nulla pede ullamcorper augue, a suscipit nulla elit ac nulla.",0,869
870,Военное,curabitur at ipsum ac,20,0,Maecenas ut massa quis augue luctus tincidunt. Nulla mollis molestie lorem.,1,870
871,Гражданское,justo pellentesque viverra,44,1,Fusce posuere felis sed lacus.,0,871
872,Гражданское,suspendisse potenti,38,1,"Maecenas leo odio, condimentum id, luctus nec, molestie sed, justo.",0,872
873,Военное,tincidunt eu,44,0,"Suspendisse ornare consequat lectus. In est risus, auctor sed, tristique in, tempus sit amet, sem.",1,873
874,Военное,luctus nec molestie sed,7,1,Etiam justo. Etiam pretium iaculis justo.,1,874
875,Военное,amet justo morbi ut,31,1,Nulla tellus.,0,875
876,Гражданское,ut massa quis,9,1,Vivamus in felis eu sapien cursus vestibulum.,0,876
877,Военное,sit amet,6,0,Nulla ut erat id mauris vulputate elementum. Nullam varius.,0,877
878,Военное,quis orci eget orci,43,1,"Morbi ut odio. Cras mi pede, malesuada in, imperdiet et, commodo vulputate, justo.",1,878
879,Гражданское,lobortis vel dapibus at,11,1,Duis ac nibh.,0,879
880,Военное,libero nam,27,0,Etiam faucibus cursus urna. Ut tellus.,0,880
881,Военное,dapibus dolor vel est,15,0,Morbi vel lectus in quam fringilla rhoncus.,1,881
882,Гражданское,elit proin,42,0,"Cum sociis natoque penatibus et magnis dis parturient montes, nascetur ridiculus mus.",1,882
883,Гражданское,donec ut,23,0,Duis ac nibh.,1,883
884,Военное,quis augue,25,0,Praesent id massa id nisl venenatis lacinia.,1,884
885,Гражданское,vestibulum,4,0,"Donec ut mauris eget massa tempor convallis. Nulla neque libero, convallis eget, eleifend luctus, ultricies eu, nibh.",1,885
886,Гражданское,a,17,1,Donec ut dolor.,0,886
887,Военное,morbi odio odio elementum,26,0,Etiam pretium iaculis justo.,1,887
888,Военное,accumsan,32,0,"Aliquam sit amet diam in magna bibendum imperdiet. Nullam orci pede, venenatis non, sodales sed, tincidunt eu, felis.",0,888
889,Военное,varius integer,14,1,"Vestibulum ante ipsum primis in faucibus orci luctus et ultrices posuere cubilia Curae; Donec pharetra, magna vestibulum aliquet ultrices, erat tortor sollicitudin mi, sit amet lobortis sapien sapien non mi. Integer ac neque.",1,889
890,Гражданское,ac,8,1,"In est risus, auctor sed, tristique in, tempus sit amet, sem. Fusce consequat.",1,890
891,Военное,neque,6,1,Ut tellus. Nulla ut erat id mauris vulputate elementum.,0,891
892,Гражданское,est phasellus sit,49,1,Nullam varius.,1,892
893,Гражданское,convallis duis,36,1,Etiam vel augue. Vestibulum rutrum rutrum neque.,0,893
894,Гражданское,nulla,20,1,"Quisque arcu libero, rutrum ac, lobortis vel, dapibus at, diam.",1,894
895,Военное,eu orci,18,1,Etiam justo.,0,895
896,Военное,id pretium,23,0,"In tempor, turpis nec euismod scelerisque, quam turpis adipiscing lorem, vitae mattis nibh ligula nec sem.",1,896
897,Военное,ultrices,23,1,Duis mattis egestas metus. Aenean fermentum.,0,897
898,Военное,rutrum rutrum,10,0,Vivamus vel nulla eget eros elementum pellentesque. Quisque porta volutpat erat.,0,898
899,Гражданское,eget orci,46,0,Aenean fermentum.,0,899
900,Гражданское,arcu,38,1,Aliquam non mauris.,1,900
901,Военное,et,6,0,"Aliquam sit amet diam in magna bibendum imperdiet. Nullam orci pede, venenatis non, sodales sed, tincidunt eu, felis.",1,901
902,Военное,nulla,6,0,In congue. Etiam justo.,0,902
903,Гражданское,est,22,1,Aliquam non mauris. Morbi non lectus.,0,903
904,Военное,curabitur convallis duis,39,1,Cras in purus eu magna vulputate luctus.,1,904
905,Гражданское,maecenas pulvinar lobortis est,43,1,Nullam molestie nibh in lectus.,1,905
906,Гражданское,mattis odio donec,41,0,Maecenas ut massa quis augue luctus tincidunt.,0,906
907,Военное,at,13,0,"Duis bibendum, felis sed interdum venenatis, turpis enim blandit mi, in porttitor pede justo eu massa.",0,907
908,Гражданское,enim sit amet nunc,7,1,Nam nulla.,1,908
909,Гражданское,ut mauris eget,26,1,Maecenas pulvinar lobortis est.,0,909
910,Гражданское,eu,33,0,Cras pellentesque volutpat dui.,1,910
911,Военное,ut,24,1,Curabitur in libero ut massa volutpat convallis.,0,911
912,Военное,curabitur gravida nisi at,22,1,Nullam molestie nibh in lectus.,0,912
913,Военное,nulla,32,1,"Cras pellentesque volutpat dui. Maecenas tristique, est et tempus semper, est quam pharetra magna, ac consequat metus sapien ut nunc.",0,913
914,Гражданское,congue,12,0,Integer ac leo. Pellentesque ultrices mattis odio.,1,914
915,Гражданское,pede ullamcorper,43,1,Proin at turpis a pede posuere nonummy. Integer non velit.,0,915
916,Гражданское,tempus,4,0,Nulla ut erat id mauris vulputate elementum.,1,916
917,Военное,porttitor,3,0,"Cum sociis natoque penatibus et magnis dis parturient montes, nascetur ridiculus mus. Etiam vel augue.",0,917
918,Гражданское,diam,36,0,Sed sagittis.,0,918
919,Гражданское,in ante vestibulum ante,48,1,"Curabitur in libero ut massa volutpat convallis. Morbi odio odio, elementum eu, interdum eu, tincidunt in, leo.",1,919
920,Военное,tellus in sagittis dui,37,1,Maecenas tincidunt lacus at velit.,1,920
921,Гражданское,nibh fusce,24,1,"Vivamus metus arcu, adipiscing molestie, hendrerit at, vulputate vitae, nisl.",1,921
922,Гражданское,ac enim in,36,1,Duis mattis egestas metus. Aenean fermentum.,1,922
923,Гражданское,mauris viverra diam vitae,41,0,"Quisque arcu libero, rutrum ac, lobortis vel, dapibus at, diam.",0,923
924,Гражданское,consequat metus sapien ut,1,1,Integer ac leo. Pellentesque ultrices mattis odio.,1,924
925,Военное,diam cras pellentesque volutpat,16,1,Praesent id massa id nisl venenatis lacinia. Aenean sit amet justo.,0,925
926,Гражданское,in,33,1,In quis justo. Maecenas rhoncus aliquam lacus.,0,926
927,Гражданское,ac enim,43,0,Nullam varius.,0,927
